,text,label
3716,what north american city would you visit to see cleopatra s needle,22
3717,who said the only thing we have to fear is fear itself,4
3718,what country did the allies invade in world war ii s operation avalanche,19
3719,where are there aborigines,16
3720,what does verdandi mean,7
3721,who coined the term nn cyberspace in his novel nn neuromancer,4
3722,what kind of puzzle first appeared in the us in the new york world on december 21 1913,14
3723,what currents affect the area of the shetland islands and orkney islands in the north sea,9
3724,what is damage to business and government caused by bureaucracy,14
3725,who created the character of scrooge,4
3726,who is nicolo paganini,34
3727,madonna advertises for what soft drink,18
3728,when do you plant winter wheat,8
3729,what are cushman and wakefield known for,9
3730,how many people live in the falklands,13
3731,who produces spumante,5
3732,what is the average life expectancy of a male in ireland in 1996,28
3733,how many years did sleeping beauty sleep,13
3734,what kind of tree graces lebanon s flag,31
3735,what is a fear of shadows,24
3736,how much did the first barbie doll sell for in 1959,26
3737,where can i find the lyrics for the song getting married today from the musical company,16
3738,what country has the most coastline,19
3739,which way do you turn your bic to increase the flame clockwise or counterclockwise,16
3740,when was john d rockefeller born,8
3741,how does james bond like his martinis,0
3742,what is the origin of the word magic,12
3743,what is the official language of algeria,40
3744,who directed jaws,4
3745,why do nt you guys have some sort of contest where you ask a question and whoever finds the answers wins a prize,9
3746,what film opens with an assassin tumbling from the seattle space needle,1
3747,what team did babe ruth play his first major league game for,5
3748,what is the movie jonathan livingstone seagull,1
3749,who made the first airplane that could fly,5
3750,what is real time processing,7
3751,who were the five marx brothers,4
3752,what famous british actor lost his voice after an operation in 1966,4
3753,who is the prime minister of japan,4
3754,how big is a quart,33
3755,what lewis carroll book introduced humpty dumpty to the world,1
3756,what does it take to become a lawyer,14
3757,what are the biggest indian airports,16
3758,what ice creams contain seaweed,18
3759,what is the name of the woman who was with john belushi when he died,4
3760,name a film in which jude law acted,1
3761,how did asia get its name,0
3762,what is porphyria,7
3763,when did jaco pastorius die,8
3764,how many of them are in subsaharan africa,13
3765,what does ibm stand for,3
3766,where does most of the marijuana entering the united states come from,16
3767,what is the airline built for professional travelers,5
3768,what are the seven wonders of the world,14
3769,how is qigong properly pronounced,0
3770,why is the moon different sizes and colors,9
3771,what is 55 times sweeter than cane sugar,18
3772,what is the best way to travel in japan,32
3773,how do you get dates with the hooters girls,0
3774,what botanical marvel did nebuchadnezzar build,16
3775,what is the cultural origin of the ceremony of potlatch,12
3776,what do river otters eat,18
3777,what strait links the mediterranean sea and the atlantic ocean,16
3778,what is the greatest hiking web site,16
3779,who created billy pilgrim a survivor of the dresden firestorm,4
3780,what company s logo is a w in a circle,5
3781,what jockey won 17 triple crown races,4
3782,what are some science fair projects for 8th graders,10
3783,what is a research expedition in mountain climbing,30
3784,what is a movie that kevin costner made about sioux indians,1
3785,who was darius,34
3786,what is so powerful about power bars,12
3787,where on the internet can i get information about the fifth amendment on the american bill of rights,16
3788,where was i have fallen and i can not get up said first,16
3789,what money was used by them,49
3790,who makes the crossyourheart bra,4
3791,what is the betterknown identity of john merrick the noble ogre of victorian england,4
3792,what was the tragedy that struck the city of dogtown in 1899,10
3793,how come light bulbs go out,9
3794,how many colonies did germany get to keep after world war i,13
3795,what is gymnophobia,7
3796,how many years did shea gould practice law in los angeles,13
3797,how can i find out how much income tax is paid on social security income on the 1998 income tax,0
3798,what is the abbreviation for limited partnership,36
3799,what country has the largest sheep population,19
3800,how long does it take for your blood to make one complete trip through the body,28
3801,what department store heir is responsible for raising a threeton safe from the underwater wreckage of the andrea doria,4
3802,what are the diseases that can be cured by black cumin,24
3803,how many fingers are used to draw a bow,13
3804,what was the name of the cook on rawhide,4
3805,what is the first personal computer company,5
3806,what does final four refer to in the sports world,21
3807,who is the one independent member of congress,4
3808,what knighted actor narrates tv s the world at war,4
3809,what is the origin of the term the brooklyn side in bowling,12
3810,what is the daily requirement of folic acid for an expectant mother,12
3811,what terror of the sea did johnny horton sing about,2
3812,what is the habitat of the chickadee,16
3813,when was london s docklands light railway constructed,8
3814,name the marvel team loosely based on dc s justice league of america,5
3815,what does el nino mean in spanish,21
3816,where is procter gamble headquartered in the us,16
3817,what is the international lawn tennis challenge trophy usually called,21
3818,what natural attractions draw the most visitors in the united states,16
3819,what james michener book is subtitled spanish travels and reflections,1
3820,how did the months of the year get there name,0
3821,what card suit originally represented the peasant class,14
3822,what former majorleague lefthanded baseball pitcher was known as space man,4
3823,what does necrosis mean,3
3824,what is the abbreviation of the international olympic committee,36
3825,what does idle mean,7
3826,what are the ten safest american cities for pedestrians,22
3827,name a golf course in myrtle beach,14
3828,what seven digits follow the area code in the number for long distance information,42
3829,what do players try to do when the music stops in a game of musical chairs,12
3830,what soft drink tells us to go hawaiian,18
3831,what made jane goodall famous,9
3832,what is the difference between a generator and an alternator,12
3833,what starfaring race brought about the inhumans on marvel s earth,30
3834,what is the name of the american swimmer who won seven gold medals in the 1972 olympics,4
3835,how effective are condoms in protecting against aids,0
3836,who is the only us president to have won a pulitzer prize,4
3837,how many astronauts manned each project mercury flight,13
3838,what religion has the most members,17
3839,who was the first governor of west virginia,4
3840,what country saw the origin of the asian flu,19
3841,what is the longest english word that can be formed using just the first row of letters on a typewriter,39
3842,what do you say to a friend who ignores you for other friends,12
3843,who directed the wild bunch,4
3844,what does the theory of quantum leaps mean in simpler terms,7
3845,why can not women serve in the navy on board submarines,9
3846,what desert has the highest sand dunes,16
3847,what was the name of roy rogers s dog,2
3848,who is the composer of canon in d major,4
3849,who was the inventor of the stove,4
3850,what tv talkshow host lends his name to a line of men s clothing,4
3851,how many square feet is bill gates home,13
3852,what actor was the first man to appear on the cover of mccall s,4
3853,what problems contributed to the high failure rate of plains farmers in the 1800s,9
3854,where is the statistical abstract of the united states online,16
3855,what is the best distance education university or college,5
3856,what actor who had greatest fame on tv became the father of triplets,4
3857,what nevada center has been dubbed the biggest little city in the world,22
3858,where did the inuits live,16
3859,how do they find an epicenter,0
3860,what 19thcentury writer had a country estate on the hudson dubbed sunnyside,4
3861,what is the meaning of the name kathryn,7
3862,how long do hermit crabs live,28
3863,what does the word opera mean,7
3864,what films featured the character popeye doyle,1
3865,what state was named the green mountain state,11
3866,how long does a dog sleep,28
3867,what is different about the red and black fox,12
3868,name the two blob members of the animated herculoids,4
3869,what is the acronym for the rating system for air conditioner efficiency,36
3870,who is the founder of scientology,4
3871,what does robert mean,7
3872,what is a hydrogen bond,7
3873,what three european countries begin with the letter a,19
3874,what is the homelite inc home page,16
3875,why did europeans first come to australia and oceania,9
3876,who invented silly putty,4
3877,what aesop s fable has the moral the race is not always to the swift slow and steady is bound to win,1
3878,what kind of business is 7eleven,5
3879,what kind of animals were in the paleozoic era,2
3880,what is a camel hair brush actually made out of,29
3881,what other name were the little rascals known as,21
3882,how much time does the blinking of an eye take,13
3883,what is a gas release event,7
3884,where did marijuana come from,12
3885,what is the population of biloxi mississippi,37
3886,what is the name of the game that garry kasparov plays,30
3887,when was cnn s first broadcast,8
3888,how do i love thee,0
3889,how many casinos are in atlantic city nj,13
3890,which language has the most words,40
3891,what is a tonne,7
3892,what is the belt of low pressure around the equator called,21
3893,what cigarette company urged us come to where the flavor is,5
3894,who is archie bunker s soninlaw,4
3895,what airport is on the piccadilly subway line,16
3896,what does shield stand for,3
3897,what year were the olympic games played in where nadia comaneci became popular,8
3898,how many john deere tractors have been manufactured,13
3899,where is the 19th hole on a golf course,16
3900,what is the name of the star of the cooking show galloping gourmet,4
3901,how many languages does the pope speak,13
3902,which ventura county police department seized the largest cocaine shipment in it is history,5
3903,what is goldenseal,7
3904,what us air force general led the first bombing raid over tokyo,4
3905,how many innings constitute an official baseball game,13
3906,how can i get in touch with michael moore of roger me,0
3907,mississippi is nicknamed what,21
3908,what color tennis balls are used at wimbledon,20
3909,what thenderogatory term was applied to the painters monet sisley pissarro renoir and degas,21
3910,what college did joe namath play football for,5
3911,when are sheep shorn,8
3912,how many names are there for eskimo people,13
3913,how many shillings more than 2 were there in a guinea,13
3914,what hymn did john steinbeck get his title the grapes of wrath from,1
3915,what is endometriosis,7
3916,for what reason did the shea gould law firm close their la office,9
3917,what is a fear of crystals or glass,24
3918,cnn is owned by whom,4
3919,what is glass made of,29
3920,what dh lawrence novel was originally titled tenderness,1
3921,who shot lee harvey oswald,4
3922,what president s favorite biblical quotation was come now and let us reason together,4
3923,where are the union stockyards,16
3924,who wrote the collector,4
3925,who followed willy brandt as chancellor of the federal republic of germany,4
3926,what president had never held an elected office until he was elected to the white house,4
3927,what are the dimensions of an ice hockey goal,43
3928,what kind of flowers does detective nero wolfe raise,31
3929,what hungarian cardinal was first a state prisoner and then a refugee in the us embassy 19561971,4
3930,what race is 1 137 miles long,30
3931,what was the infamous feat of germany s u2 submarine,12
3932,what is thalassemia,7
3933,what is the great american family cereal,18
3934,name the various superteams to which the angel has belonged,5
3935,whose old london comeon was buy my sweet lavender,4
3936,who played the title role in the romantic englishwoman,4
3937,how deep is a fathom,43
3938,why are the ears your center of balance,9
3939,what is the red planet,7
3940,how does the chain of command work inside an us army apache helicopter,0
3941,what song served as the closing theme of the johnny cash show,1
3942,what are the largest breweries in the world,16
3943,why do oceans contain salt water instead of fresh water,9
3944,what is the definition of cosmology,7
3945,what country is the biggest producer of tungsten,19
3946,whose singing voice was dubbed in for natalie wood in west side story and audrey hepburn in my fair lady,4
3947,what part of their attire were pothooks to cowboys of the old west,14
3948,who were leaders of the byzantine empire,4
3949,on average how many miles are there to the moon,13
3950,how does the tail affect the flight of a kite,0
3951,what does a red flag mean in auto racing,7
3952,what card game derived its name from biritch or russian whist,30
3953,what is viscosity,7
3954,where do i find information for foreclosure properties on the internet,16
3955,why do the chickenpoxs last so long,9
3956,what is a person s socioeconomic position,7
3957,what does freddy freeman say to become captain marvel jr,12
3958,what relative of leo tolstoy translated war and peace eight times,4
3959,where are the busiest amtrak rail stations in the us,16
3960,in what us state was the first woman governor elected,11
3961,how many people died in the vietnam war,13
3962,what texas surgeon performed the first artificial heart transplant,4
3963,what caused shea gould to close their la office,9
3964,what is the history of the hairdryer,12
3965,what do i need to learn to design web pages,12
3966,who owns the rights on a tv program,4
3967,who sells viagra,4
3968,how large is the arctic refuge to preserve unique wildlife and wilderness value on alaska s north coast,33
3969,in what part of the world is mozambique,16
3970,what is the secret of the universe,12
3971,the olympic games in which year allowed nadia comaneci to become popular,8
3972,what famed tennis tournament s men s singles title was fred perry the last englishman to win,30
3973,who is pia zadora s millionaire husband and mentor,4
3974,how many cards is each player dealt in contract bridge,13
3975,what condiment do the dutch dip their french fries in,18
3976,what ocean does mauritania border,16
3977,who is the director and editor of the movie big starring tom hanks,4
3978,where can i find info on research being done on oilseeds thru genetics,16
3979,what is the no 1 killer in industrialized countries,14
3980,what is the largest lake in north america,16
3981,what are john c calhoun and henry clay known as,21
3982,what is the nature of learning,7
3983,what country was brian boru an 11thcentury king of,19
3984,what singer s hit song inspired the dolly parton stallone movie rhinestone,4
3985,in what state was there an 11 million gallon oil spill,11
3986,whose husbands have included conrad hilton jr and michael wilding,4
3987,who is snoopy s archenemy,4
3988,who lives at 39 stone canyon way,4
3989,where can i get information and statistics on countries and nations,16
3990,how many doublewordscore spaces are there on a scrabble crossword game board,13
3991,when was franklin d roosevelt stricken with polio,8
3992,what is the largest us state east of the mississippi,11
3993,name the five positions who are in the line of succession to the presidency,6
3994,how can i get a comic character i made copyrighted and published,0
3995,what did delilah do to samson s hair,12
3996,what is the name of tom sawyer s aunt with whom he lives,4
3997,who were john f kennedy s dogs,2
3998,where are diamonds mined,16
3999,which mammal lives breeds eats and sleeps underground,2
4000,what kind of animals are dorsets lincolns oxfords and southdowns,2
4001,what is the proud claim to fame of the young women who formed kappa alpha theta,9
4002,what is the difference between the koran and the bible,12
4003,what are differences between 1980 and 1990,12
4004,name the child left on a doorstep at the beginning of gasoline alley,4
4005,how did lee harvey oswald purchase his rifle,0
4006,how many days does a typical mayfly live,13
4007,how many spaces follow a period at the end of a sentence,13
4008,how many tiles did the space shuttle columbia lose on its second flight,13
4009,who made the first gas engine,4
4010,who painted mother and child,4
4011,what is carpal tunnel syndrome,7
4012,what do you call a section of your finger from one joint to another,21
4013,where can i buy a hat like the kind jay kay from jamiroquai wears,16
4014,what united states city produces the most oil,22
4015,what animal has the biggest eyes,2
4016,what astronomical phenomenon takes place in jan 1999,10
4017,what 1965 film had jack lemmon portraying a cartoonist,1
4018,what year did the vietnam war end,8
4019,what is shirley maclaine known as,21
4020,what is the pennsylvania state income tax rate,41
4021,what is a cullion,7
4022,why are haunted houses popular,9
4023,what animal was the heatseeking missile called the sidewinder named for,2
4024,name pittsburgh s baseball team,5
4025,what does a topophobic actor suffer from,24
4026,what country did the nile river originate in,19
4027,what is snoogans,7
4028,how long was mao s 1930s long march,43
4029,what bowl game began as an eastwest contest between michigan and stanford in 192,30
4030,what british commander surrendered to george washington at yorktown in 1781,4
4031,what is a portal,7
4032,where did the term 86 come from,12
4033,what state did anita bryant represent in the 1959 miss america contest,11
4034,what baseball player was walked the most times,4
4035,what does saute mean,7
4036,what is an aortic abdominal aneurysm,7
4037,how can i transport files from one computer to another,0
4038,what prompted the copilot of the enola gay to enter only my god in his log,9
4039,what should the temperature be set at while baking peachy oat muffins,44
4040,what causes someone to be ticklish,9
4041,how was the aclu formed,0
4042,why are lions called king of the jungle,9
4043,from what cause does tuberculosis stem,9
4044,what is the speed of the mississippi river,38
4045,which country is the largest country in latin america,19
4046,what can i use to remove the stubborn gummed labels from some diskettes,14
4047,how many games are played in a fiveteam roundrobin tournament,13
4048,what country contains the highest point in south america,19
4049,what element from the periodic table is a gas or a solid but never a liquid,29
4050,what is tetrinet,7
4051,what is the definition of a witch,7
4052,what does the name gina mean,7
4053,what kind of suit did true hepcats wear in 1942,27
4054,what is the homelite inc home page,16
4055,what does a spermologer collect,14
4056,how long was the longest sneezing attack,28
4057,why is the development of space so important,9
4058,what does a farrier put shoes on,14
4059,where is the kalahari desert,16
4060,what beer is rockin america,18
4061,how does a hydroelectric dam work,0
4062,what company markets a shampoo for brunettes only,5
4063,where is the group m people from,16
4064,where can i get information on the original 13 us colonies,16
4065,what is a fear of failure,24
4066,what is the fastest commercial automobile that can be bought in the us,14
4067,what is the latitude and longitude of el paso texas,37
4068,what are other ways of getting stretch marks besides pregnancy weight loss and weight lifting,32
4069,how do you calculate the change in enthalpy of a chemical reaction,0
4070,what four forms does gold occur in,14
4071,what is the theory of equivalence states,7
4072,what common plant has a button cap cup gills and ring,31
4073,what color are tennis balls,20
4074,what is the deepest area of the arctic ocean,16
4075,when did hitler come to power in germany,8
4076,what is the secondbiggestselling magazine in america,1
4077,what are the lyrics to the star spangled banner,12
4078,what does the ts stand for in ts eliot s name,3
4079,what was the sequel to the pink panther,1
4080,what characteristics contribute to its intelligence,9
4081,what species was winnie the pooh,2
4082,name the first russian astronaut to do a spacewalk,4
4083,what island group is guadalcanal a part of,16
4084,who betrayed norway to the nazis,4
4085,what are the chances of pregnacy if the penis does not penetrate the vagina,41
4086,what is the origin of the term buffalo wings that is used as a menu item in bars across the nation for chicken wings in a spicey sauce,12
4087,where can i read about abraham lincoln,16
4088,how many people died on dday,13
4089,where could i go to take a ride on a steam locomotive,16
4090,what product features a frog that says dig em,27
4091,what day is august 13 1971,8
4092,what is a fear of glass,24
4093,who is charles lindbergh,34
4094,how many people in america snore,13
4095,how do you fix squeaky floors,0
4096,how can i find a list of celebrities real names,0
4097,what is the motto for the state of maryland,12
4098,who was the oldest us president,4
4099,which of the seven dwarfs comes first alphabetically,4
4100,what color is chablis,20
4101,what ship did lloyd m bucher command,47
4102,who portrayed the man without a face in the movie of the same name,4
4103,how is it correct to say qigong,0
4104,what two historical figures who fought each other in a famous battle each have a food named after them,4
4105,how many grooves are on a dime s edge,13
4106,what is a fear of trees,24
4107,how many spears are there on kenya s flag,13
4108,what do the 12 days of christmas mean,7
4109,what was the favorite sport of tom wolfe s the pump house gang,30
4110,what is the capital of seattle,22
4111,how many layers does a bottle of yoohoo settle into,13
4112,what radio tv and movie character did jackie gleason and william bendix play,4
4113,how long were tyrannosaurus rex s teeth,43
4114,how many frames does a disk camera shoot,13
4115,name the only extant trilogy of classical greek plays,1
4116,what is the name of the michelangelo painting that shows two hands with fingers touching,1
4117,who is always trying to get the rent from andy capp,4
4118,what is the largest snake in the world,2
4119,how far away is the moon,43
4120,who is the fastest guitarist,4
4121,how do you box train a cat,0
4122,what harmful chemicals are in bug spray,29
4123,who is count cinzano,34
4124,who shoplifts,4
4125,what is a courier,7
4126,how can you tell if someone is lying,0
4127,who is the worst us president ever,4
4128,how many colors are there in a rainbow,13
4129,what is april s gemstone,14
4130,what is the name of the planet that the ewoks live on,16
4131,what does a dipsomaniac crave,14
4132,what are the numbers that fit into fermont s last theorem,37
4133,which sex is denied voting rights in kuwait,14
4134,what is the current ticket fare from from cairo to barbados,26
4135,what is a fear of being alone,24
4136,why do airliners crash vs gliding down,9
4137,what is the name of the city that maurizio pellegrin lives in,22
4138,what southern california town is named after a character made famous by edgar rice burroughs,22
4139,who was the actor who played sam in the movie casablanca,4
4140,who is played the most games for the new york yankees,4
4141,what is the most famous german word in the english language,39
4142,how do you say 2 in latin,21
4143,what country was first to use the airplane as a weapon of war against the turks in libya,19
4144,what us state has the lowest highest elevation at 6 feet,11
4145,what film had bette davis creating a scandal by wearing a daring red gown to a society ball,1
4146,what is dudley doright s horse s name,2
4147,who said the victor will never be asked if he told the truth,4
4148,why did the chicken cross the road,9
4149,how big is our galaxy in diameter,33
4150,how can you contact play producers and promoters online,0
4151,approximately how much does a teaspoon of matter weigh in a black hole,48
4152,where is los vegas,16
4153,what was the worst hurricane,10
4154,name one of the major gods of hinduism,4
4155,what body of water does the danube river flow into,16
4156,in what city or state do the most gay men live in,16
4157,how many electoral votes does it take to win presidency,13
4158,why does it say on children s cough syrup not to drive while using this medication,9
4159,how does a rainbow form,0
4160,what new year is celebrated on february 16th,10
4161,what are darning needles and horse stingers better known as,21
4162,what does a phobophobe fear,14
4163,what started in 1849 when gold was discovered at sutter s mill,10
4164,what color bottles do good rhine wines come in,20
4165,when did princess diana and prince charles get married,8
4166,when will the millennium officially begin,8
4167,what is zionism,7
4168,what was the average life expectancy during the stone age,28
4169,what does visine get out,14
4170,how do storms form,0
4171,who is robin williams,34
4172,who owns the st louis rams,4
4173,who is coronado,34
4174,how do you make panoramic sugar eggs for easter the ones with the scene inside,0
4175,what is a horologist,7
4176,what is the chemical reactivity of argon,37
4177,what line of candy products included super skrunch and peanut butter oompas,18
4178,what is the best way to lose the flab under your chin and around your face,32
4179,what country offered albert einstein its presidency in 1952,19
4180,what country was general douglas mcarthur in when he was recalled by president truman,19
