,text,label
933,how many four star generals were there and who are they,13
934,what country boasts the southernmost point in continental europe,19
935,what baseball outcome required nine balls in 1879 eight balls in 1880 and seven balls in 1881,30
936,what is the chemical reactivity of helium,37
937,what kind of greeting is appropriate to send on yom kippur,12
938,what actor first portrayed james bond,4
939,what barroom judge called himself the law west of the pecos,4
940,what was the name of the lawyer who represented randy steven craft,4
941,what developed a crack in 1835 while tolling the death of us chief justice john marshall,14
942,where did guinea pigs originate,16
943,what are the major companies that are part of dow jones,5
944,what is the most popular form of bridge,14
945,how old is the universe,28
946,who invented the fax machine,4
947,who was chief engineer of the starship enterprise,4
948,what actress has received the most oscar nominations,4
949,who is the prophet that is most connected to the dead sea,4
950,what illfated american general dragged a bull terrier named willie through world war ii,4
951,how high is the city of denver,43
952,why did the shea gould law firm leave los angeles,9
953,what poet wrote i have promises to keep and miles to go before i sleep,4
954,when was the first railroad from the east coast to the west coast completed,8
955,where is mccarren airport,16
956,where can i find a fifth element screensaver,16
957,what was the outcome of the 1945 yalta conference,12
958,when was the berlin wall erected,8
959,what metropolis landmark was first introduced in the superman cartoons of the 1940 s,16
960,what format was vhs s main competition,14
961,who claimed he killed 4 280 buffalo as food for the crew building the kansas pacific railway,4
962,what do you call a book of quotes,21
963,who created the character james bond,4
964,how many megawatts will the power project in indonesia built by a consortium headed by mission energy of us produce,13
965,what is typhoid fever,7
966,what was marilyn monroe s real name,4
967,what is the highest continent,16
968,what did louis cartier invent for aviator santos dumont in 1940,14
969,define sinn fein,7
970,how do i impress a guy,0
971,who is the mathematician that won the noble prize for literature in 1950,4
972,what daughter of henry viii and anne boleyn became queen of england,4
973,what is the classic definition of tragic hero,7
974,who was considered to be the father of psychology,4
975,what was the first usbased team in the nhl,5
976,what snack food has ridges,18
977,what are tonsils for,9
978,what is a wop,7
979,how long does a fly live,28
980,who played sally rogers on the dick van dyke show,4
981,how many words are there in the spanish language,13
982,what is the price for tuberculosis drugs,26
983,in what year did thatcher gain power,8
984,whose video is titled shape up with arnold,4
985,when was hurricane hugo,8
986,why was muhammad ali stripped of his title and barred from boxing in 1967,9
987,how old was lucille ball when the show i love lucy premiered,28
988,what are the five richest countries in the world,19
989,who was the first elected mayor of washington dc,4
990,ray charles plays which instrument,35
991,what type of bridge is the golden gate bridge,14
992,what is the federal minimum wage,26
993,what new england state covers 59 square miles,11
994,what is the leading pecan and peanut growing state,11
995,what did cool hand luke go to jail for,9
996,what two us biochemists won the nobel prize in medicine in 1992,4
997,how much money was the minimum wage in 1991,26
998,how do they get teflon to stick to the pan,0
999,how many horses died during the civil war,13
1000,who made the musical plea be true to your school,4
1001,how many american soldiers remain unaccounted from the vietnam war,13
1002,who is the famous sister of actress olivia de havilland,4
1003,what is the world s best selling cookie,18
1004,what jrr tolkien book features gimli as a central character,1
1005,what is bph,3
1006,what prison is found in ossining new york,16
1007,what incident caused the canning of a summit conference between eisenhower and khrushchev,9
1008,how many major nazi leaders went on trial after the war at nuremberg,13
1009,why is the mile 528 feet,9
1010,what country is the largest diamond producer,19
1011,what grand slam golf tournament was not held between 1940 and 1945,30
1012,when is president nixon s birthday,8
1013,the kentucky horse park is located near what city,22
1014,what explorer was nicknamed iberia s pilot,4
1015,what predators exist on antarctica,2
1016,what is dick clark s birthday,8
1017,what country would you visit to ski in the dolomites,19
1018,who was confucius,34
1019,how many thousands of students attend the university of massachusetts,13
1020,which doonesbury character was likely to turn into a werewolf,4
1021,what auto race was wilbur reed the first to win three times,30
1022,in what area of the world was the six day war fought,16
1023,how can i determine the radius of an ellipse,0
1024,what operating system do ibmcompatible machines use,27
1025,what is columbia tristar s phone number,42
1026,how many watts make a kilowatt,13
1027,what does philebuslike mean,7
1028,what mexican leader was shot dead in 1923,4
1029,what are the most common elements in seawater,29
1030,who invented astroturf,4
1031,what are the highestpaying odds on a roulette table,41
1032,who invented the vacuum cleaner,4
1033,what is the average age of a member of the team that worked on the manhatten project,28
1034,what is cosmology,7
1035,what us state is mammoth cave national park in,11
1036,what is money made of,29
1037,how can i find out my moon sign,0
1038,what turns blue litmus paper red,14
1039,what is the northernmost us state apart from alaska,11
1040,what are the four railways in monopoly,5
1041,what letter does gorbachev s middle name start with,15
1042,what new york yankee was known as the iron horse,4
1043,which of the following people is not associated with andy warhol,4
1044,who was red grange,34
1045,what 1963 joseph l mankiewicz film cost 28 million,1
1046,where is glasgow,16
1047,when did lucelly garcia a former ambassador of columbia to honduras die,8
1048,what is the trademark of a washington redskin s fan,45
1049,in what year did ireland elect its first woman president,8
1050,when did mount st helens last erupt,8
1051,what is a disaccharide,7
1052,what is a storm surge,7
1053,what is the largest city in connecticut,22
1054,what are pushed and coupled in hump yards,14
1055,name the vessel used by the atari force in the dc comics,47
1056,how many referees work a soccer game,13
1057,how much does a new railroad coal car cost,26
1058,who led the opposition when konrad adenauer was chancellor in germany,4
1059,where can one find mozambique,16
1060,what is a mexican hairless,7
1061,what was dwight eisenhower s favorite card game,30
1062,how many years make up a lustrum,13
1063,what is the literal meaning of dday,7
1064,what penalty space lies between baltic avenue and reading railroad on a monopoly board,14
1065,what does semper fidelis mean,7
1066,what was called the world s largest department store,5
1067,what river flows through vienna budapest and belgrade,16
1068,what batman character tools around on a batcycle,4
1069,what fossilizes to form coprolite,14
1070,what is played at wembley stadium london every may,30
1071,how can your school march in the macy s thanksgiving parade,0
1072,what is the current population for these countries france spain italy greece austria germany switzerland the netherlands,13
1073,what function does a community s water tower serve,9
1074,who killed caesar,4
1075,what is the origin of blue for boys and pink for girls,12
1076,how long was the tv mission of star trek s enterprise to be,28
1077,how many real fruit juices are there in a can of hawaiian punch,13
1078,what is the most powerful card in euchre,14
1079,what soft drink is most heavily caffeinated,18
1080,what does salk vaccine prevent,24
1081,in order from the top the four stripes on a can of pepsi are what colors,20
1082,what planet gave bith to superman,16
1083,what type of animal is the easiest kept pet there is,2
1084,what is the amish religion,7
1085,what colors make up a rainbow,20
1086,what scandinavian country covers 173 732 square miles,19
1087,what is the horsepower of the shuttle boosters,37
1088,in what year was de gaulle elected president of france,8
1089,how long does it take the typical american to eat 23 quarts of ice cream,28
1090,how many south american countries have the letter z in their names,13
1091,how long does it take for your body to restore blood after you donate your blood,28
1092,who is the incredible hulk in reality,4
1093,what city is served by mccarren airport,22
1094,what is the name given to a group of geese,2
1095,what 1953 film won frank sinatra a best supporting actor oscar,1
1096,kosovo is a province of what country,11
1097,what is known as the queen of drinks,18
1098,why does not wwwanswerscom have any answers to my questions,9
1099,what are the top five oilproducing countries in the world,19
1100,what is the purpose of the sysrq key on my computer keyboard,9
1101,where is santa lucia,16
1102,what russian city used to be called st petersburg and petrograd,22
1103,who is prince naseem hamed,34
1104,what was the name of randy craft s lawyer,4
1105,what nutrients are for healthy bones and teeth,18
1106,what kennedy was married to ethel,1
1107,where is the rose bowl played,16
1108,what is a fear of pregnancy,24
1109,what is the nickname of oddsmaker jimmy snyder,4
1110,what was the claim to fame of the football game that saw fordham defeat waynesburg state 12601 on september 3 1939,9
1111,what major victorian novelist spent as much time working for the post office as he did writing,4
1112,how much do drugs to treat tuberculosis cost,26
1113,what kind of books does fodor s publish,1
1114,what is the difference between ninjitsu and kung fu,12
1115,what is the highest number of home runs on record for any one game,13
1116,what is the softest part of the body,23
1117,what bread company used to feature stickers of the cisco kid on the ends of their packages,5
1118,what is the average cost for four years of medical school,26
1119,shea and gould had an office in los angeles for how long before closing it,28
1120,what are the top vegetable crops in the world,18
1121,where does mother angelica live,16
1122,what state is john f kennedy buried in,11
1123,where is the largest post office building in the world,16
1124,what is drew barrymore s middle name,4
1125,what is a fear of bees,24
1126,where do rocks come from,12
1127,how do i find a city if i have the area code,0
1128,what contemptible scoundrel stole the cork from my lunch,4
1129,what musical instrument did prewitt play in james jones s from here to eternity,35
1130,who is the antichrist,4
1131,what is false consciousness,7
1132,in what county is eckley colorado,16
1133,how many dots make up the symbol for because,13
1134,why do movie and tv stars get paid so much,9
1135,where can i find information on becoming a journalist,16
1136,how many url extensions are there and what are they,13
1137,what is the nursery rhyme rockaby baby about,12
1138,what do christian scientists believe in,12
1139,what was the name of the us navy gunboat in the film the sand pebbles,47
1140,when did mount st helen last have a major eruption,8
1141,what color is the cross on switzerland s flag,20
1142,what are the words to my way written by paul anka,12
1143,what did vasco da gama discover,14
1144,what does an irate car owner call iron oxide,21
1145,which nba players had jersey number 0,4
1146,what longtime game show host dropped dead while jogging in central park in 1984,4
1147,how do you reference a website,0
1148,what was archy and mehitabel,7
1149,where did he get the title,16
1150,what is dick clark s date of birth,8
1151,what are the star wars satellites,7
1152,what are the seven deadly sins,12
1153,how many degrees cooler is the inside of a cucumber than the air outside,13
1154,what south african producer had a 1988 profit of 836 million,5
1155,what is the term for a limestone deposit rising from the floor of a cave,21
1156,what is the origin of gametophytic tissue,12
1157,what is the meaning of wb yeat s poem the three hermits,7
1158,what is the origin of infinity,12
1159,where can i find free piano scores for popular music,16
1160,what pope inaugurated vatican international radio,4
1161,what business exports the sparkling wine spumante,5
1162,what two vessels fought the first sea battle between ironcovered ships,47
1163,how many different countries export coffee,13
1164,what is the student population at the university of massachusetts in amherst,37
1165,what is the difference between a college and a university,12
1166,what is an urban legend,7
1167,what is the origin of the name scarlett,12
1168,what 1950 film won seven oscars including best picture,1
1169,what american won the world grand prix driving championship in 1978,4
1170,what is the name of the pop singer whose song became the theme song for a brand of catsup,4
1171,what mayor made so many tv appearances he was asked to join aftra in 1984,4
1172,what was the tallest building in america in 1922,16
1173,which airplane was fawaz younis convicted of hijacking,47
1174,what seven digits follow the area code in the number for long distance information,42
1175,how is answerscom different from knowpostcom,0
1176,who is the prophet of medina,4
1177,what tv show premiered on january 15 1981,1
1178,what was the christian name of the title character in our miss brooks,4
1179,what do i need to do to take my dog with me to live in dominica west indies for a year,12
1180,which gender has bigger thighs,14
1181,how do you get a broken cork out of a bottle,0
1182,what is the origin of us army sergeant s stripes,12
1183,how many varieties of apple are there,13
1184,what us university boasts the largest library,5
1185,what continent is bolivia on,16
1186,how tall is prince charles,43
1187,who created private detective philip marlowe,4
1188,who else was considered for the role of luke skywalker when george lucas was casting for star wars,4
1189,what european city do nicois live in,22
1190,why can not ostriches fly,9
1191,what is the recomended age to switch a child from a crib to a bed,28
1192,where can i find correct tabs for third eye blind songs,16
1193,what is california s capital,22
1194,who starred in singing in the rain and the singing nun,4
1195,who was quetzalcoatl,34
1196,what is an example of a natural acidbase indicator,14
1197,what magic does mandrake employ,14
1198,whose cover is that of an employee of universal import and export,4
1199,what was john steinbeck s travelling companion charley,14
1200,where are the tropical rain forest distributions,16
1201,what london street is the home of british journalism,16
1202,what animal has been called the poor man s cow,2
1203,what food of the three bears did goldilocks eat,18
1204,what country is the setting for edgar allan poe s the pit and the pendulum,19
1205,what country borders the most others,19
1206,what is the origin of barbeque,12
1207,what mormon leader was said to have had 27 wives,4
1208,what is a fear of ruin,24
1209,who invented the paper clip,4
1210,what kind of weapons were used in medieval warfare,14
1211,what british prime minister and us president were seventh cousins onceremoved,4
1212,why was curious george curious,9
1213,how can you define time,7
1214,what kind of dog is scooby doo,2
1215,what is a conifer,7
1216,what were the causes of the civil war,9
1217,who directed the first woody woodpecker cartoon,4
1218,what does nafta stand for,3
1219,what was joe namath s first contract worth,26
1220,what was an asiento,7
1221,which city in china has the largest number of foreign financial companies,22
1222,who claims to have the greatest show on earth,4
1223,when was the last major eruption of mount st helens,8
1224,what is a bone marrow transplant,7
1225,what is the origin of the word jj,12
1226,what city houses the us headquarters of procter and gamble,22
1227,who wrote unsafe at any speed,4
1228,what is the best selling computer model ever,27
1229,who invented the wonderbra,4
1230,what drug is often used to treat aids patients,24
1231,what is the purpose of a car bra,9
1232,where can i find a website that gives comparisons of good prices,16
1233,what task does the bouvier breed of dog perform,6
1234,what do penguins eat,18
1235,how much snow equals an inch of rain,13
1236,what record company was formed by herb alpert and jerry moss,5
1237,what are the names of all the us navy aircraft carriers,47
1238,who was international olympic committee chairman at the 1936 summer games,4
1239,what is ray bradbury s illustrated man illustrated with,14
1240,what state has the most indians,11
1241,what is the last name of lucy and linus from the peanut s comic strip,4
1242,how much did manchester united spend on players in 1993,26
1243,what are the various ways in which one can measure it user satisfaction level,32
1244,what is the medical term for cancer of the blood,24
1245,what was the first sam spade novel,1
1246,what does elysium mean,7
1247,where was the first restaurant,16
1248,what do bicornate animals have two of,14
1249,who is known as the world s oldest teenager,4
1250,what is website of the international court of justice,16
1251,how many different vegetation zones are there,13
1252,how many calories are there in a big mac,13
1253,what is the smallest country in africa,19
1254,who invented the fountain,4
1255,whose first presidential order was let us get this goddamn thing airborne,4
1256,the film jaws was made in what year,8
1257,where is natchitoches louisiana,16
1258,who played the original charlie s angels,4
1259,where is the human skin least sensitive,23
1260,where does the song anything goes take place,16
1261,what famed strip of land is a 15minute boat trip across the venetian lagoon from venice,16
1262,where did the maya people live,16
1263,what are the statistics for drunken drivers in maryland,37
1264,who is the current prime minister and president of russia,4
1265,name the fast food chain with the golden arches,5
1266,what does esapekka salonen look like,12
1267,what indoor sport saw the phoenix inferno become the phoenix pride on july 14 1983 when the temperature hit 111 degrees,30
1268,what was the name of randy steven craft s lawyer,4
1269,what are the names of jacques cousteau s two sons,4
1270,what is the fastestgrowing comic strip of all time,1
1271,how many sonnets did shakespeare write,13
1272,what is another name for nearsightedness,21
1273,why does a woman have to be a virgin to be a nun,9
1274,what was the first tv set to include a remote control,14
1275,what are the top boy names in the us,4
1276,what country has problems with hooligans,19
1277,what was the us highway death toll in 1969,13
1278,who is the leader of brunei,4
1279,who would you use the heimlich maneuver on,4
1280,what is the origin of the term soda jerk,12
1281,what cooking oil has corn goodness,18
1282,what is measured in curies,7
1283,how many liberty bells have there been,13
1284,what company sells the most greeting cards,5
1285,who was the democratic nominee in the american presidential election,4
1286,what season is the setting for shakespeare s midsummer night s dream,8
1287,what plant has the largest seed,31
1288,who is samuel f pickering,34
1289,who are the nomadic hunting and gathering tribe of the kalahari desert in africa,5
1290,who is the fastest swimmer in the world,4
1291,what is the world s longest suspension bridge,16
1292,what is the wingspan of a condor,43
1293,what facial feature typically contains about 55 hairs,12
1294,what is the brand name of the chemical daminozide,27
1295,what are liver enzymes,7
1296,how many electoral college votes does colorado have,13
1297,when was the women s suffrage amendment ratified,8
1298,what female suspect in the game of clue is single,4
1299,the iraqis launched their attack on kuwait on what day,8
1300,what european country boasts the city of furth found where the rivers rednitz and pegnitz converge,19
1301,what is the weight of air,48
1302,what us president had brothersinlaw in the confederate army,4
1303,what does the name justin mean,7
1304,what vowel do all esperanto nouns end in,15
1305,what film ends with the line this is mrs norman maine,1
1306,what cherokee indian gave his name to a tree,4
1307,what cbs soap opera was interrupted by the bulletin of john f kennedy s assassination,1
1308,what do the japanese call japan,21
1309,what was the man s name who was killed in a duel with aaron burr,4
1310,how many horses are there on a polo team,13
1311,how much stronger is the new vitreous carbon material invented by the tokyo institute of technology compared with the material made from cellulose,13
1312,in what religion was isis the nature goddess,17
1313,what does an average daycare provider get paid in new england,26
1314,name the on stage character whose face was never seen,4
1315,what are the 10 plagues of egypt,24
1316,who headed hitler s infamous gestapo,4
1317,what is the regular price,26
1318,who created dennis the menace,4
1319,what is japan s largest car manufacturer,5
1320,what does nasa stand for,3
1321,what group starred in the movie rock around the clock,5
1322,what was another name for east germany,21
1323,how old is bernadette peters,28
1324,what does antidisestablishmentarianism mean,7
1325,what is a serigraph,7
1326,what actor has a tattoo on his right wrist reading scotland forever,4
1327,what is a male witch called,21
1328,who did the seven mules block for,4
1329,how many russians have landed on the moon,13
1330,what sport is chris jogis a top player of,30
1331,how many elephants are left on earth,13
1332,what is the origin of the peace symbol,12
1333,how do i increase my biceps size,0
1334,who invented the road traffic cone,4
1335,what caused the division between the anglicans and the vatican,9
1336,where is the massive north korean nuclear complex located,16
1337,what is the claim to fame of night watchman frank wills,9
1338,what is the highest roman numeral,7
1339,what don mclean song laments the day buddy holly died,1
1340,why is microsoft s windows 3 software so successful,9
1341,how many miles of corridors are in the pentagon,13
1342,who was darth vader s son,4
1343,how many people are there in the world,13
1344,how do i find out the exact time of a sunset for a particular day,0
1345,what american poet wrote good fences make good neighbors,4
1346,how do i know someone is truly in love with me,0
1347,what were the three prophecies the witches make to macbeth,12
1348,what foods contain vitamin b12,18
1349,what book is subtitled the preservation of favoured races in the struggle for life,1
1350,what language is mostly spoken in brazil,40
1351,what us state borders illinois to the north,11
1352,what is the capital of monaco,22
1353,why is poop sometimes different colors,9
1354,how much is a canadian 1967 twenty dollar gold coin worth,26
1355,what year did charles dicken die,8
1356,what sea is bombay on,16
1357,what is capitalism according to max weber,7
1358,what is a handheld pc,7
1359,what two countries in south america are landlocked,19
1360,who was lacan,34
1361,how long was the oj simpson trial,28
1362,what do you call a group of geese,2
1363,who invented the pulltab opener on cans,4
1364,what does knight ridder publish,1
1365,how many marx brothers were there,13
1366,how much in miles is a ten k run,13
1367,what state has the longest great lakes shoreline,11
1368,what famous soldier was born in europe died in asia and was laid to rest in africa,4
1369,how long does a human live,28
1370,what is an easy way to count the approximate number of fish in a lake,32
1371,what steps can be taken to prevent diabetes,12
1372,what animal has killed the most people,2
1373,what is the claim to fame of agra india,9
1374,what product s ads claim that it eliminates odors kills household germs mold and mildew,27
1375,why do they call it a funny bone,9
1376,when was cigarette advertising banned on television and radio,8
1377,where do the adventures of the swiss family robinson take place,16
1378,what was the living room war,7
1379,what fool is not so wise to lose an oath to win a paradise,4
1380,what is another name for aspartame,21
1381,what presidential administration challenged americans to explore the new frontier,5
1382,what time of year do most people fly,8
1383,what animal occurs in spielberg s jaws,2
1384,how much did varian associates try to sell its vacuum products division to the boc group for,26
1385,what is the capital of iowa,22
1386,how old is singer freedy johnston,28
1387,what did jimmy stewart invent,14
1388,what is the nearest star to earth,16
1389,what are the signs of a country going into a recession,45
1390,what household products are there for adult acne,27
1391,what are some good fractal web sites,16
1392,what playing card symbolizes death,45
1393,what was originally defined as one 1millionth of the distance from the equator to the pole,21
1394,what body of water does the yukon river empty into,16
1395,what did the yalta conference lead to,14
1396,how many equal sides are there on a scalene triangle,13
1397,when was the triangle shirtwaist fire,8
1398,how many people visit the pope each month,13
1399,name the french historical period during the reign of napoleon iii,10
1400,where on the internet can i find information on laundry detergent,16
1401,what was the name of betty boop s dog,2
1402,how much did a mcdonald s hamburger cost in 1963,26
1403,what river is windsor castle on,16
1404,who won the first world series,4
1405,who is dear abby,34
1406,how long did it take stanley to find livingstone,28
1407,how many states have a lottery,13
