,text,label
6391,lrb soderbergh rrb tends to place most of the psychological and philosophical material in italics rather than trust an audience s intelligence and he creates an overall sense of brusqueness,1
6392,writerdirector juan carlos fresnadillo makes a feature debut that is fully formed and remarkably assured,4
6393,the kind of film that leaves you scratching your head in amazement over the fact that so many talented people could participate in such an illadvised and poorly executed idea,0
6394,falls short in explaining the music and its roots,2
6395,each story is built on a potentially interesting idea but the first two are ruined by amateurish writing and acting while the third feels limited by its short running time,1
6396,a fascinating but choppy documentary,2
6397,sweetly sexy funny and touching,4
6398,like all of egoyan s work ararat is fiercely intelligent and uncommonly ambitious,3
6399,even if invincible is not quite the career peak that the pianist is for roman polanski it demonstrates that werner herzog can still leave us with a sense of wonder at the diverse marvelously twisted shapes history has taken,3
6400,the film is really closer to porn than a serious critique of what is wrong with this increasingly pervasive aspect of gay culture,1
6401,this is a movie that starts out like heathers then becomes bring it on then becomes unwatchable,1
6402,it is a cool event for the whole family,4
6403,time literally stops on a dime in the triessohardtobecool clockstoppers but that does nt mean it still wo nt feel like the longest 90 minutes of your moviegoing life,0
6404,yep it is waking up in reno,2
6405,a beautiful entertaining two hours,4
6406,though it pretends to expose the life of male hustlers it is exploitive without being insightful,1
6407,too long and larded with exposition this somber cop drama ultimately feels as flat as the scruffy sands of its titular community,1
6408,another love story in 2002 s remarkable procession of sweeping pictures that have reinvigorated the romance genre,3
6409,it is sobering particularly if anyone still thinks this conflict can be resolved easily or soon,2
6410,the chateau belongs to rudd whose portrait of a therapydependent flakeball spouting french malapropisms is a nonstop hoot,3
6411,the story is inspiring ironic and revelatory of just how ridiculous and moneyoriented the record industry really is,4
6412,love may have been in the air onscreen but i certainly was nt feeling any of it,1
6413,this director s cut which adds 51 minutes takes a great film and turns it into a mundane soap opera,1
6414,the dangerous lives of altar boys has flaws but it also has humor and heart and very talented young actors,3
6415,when you resurrect a dead man hard copy should come aknocking no,2
6416,i admit it i hate to like it,2
6417,movies like high crimes flog the dead horse of surprise as if it were an obligation,0
6418,an amusing and unexpectedly insightful examination of sexual jealousy resentment and the fine line between passion and pretence,4
6419,producer john penotti surveyed high school students and came back with the astonishing revelation that they wanted to see something that did nt talk down to them,3
6420,it is just a movie that happens to have jackie chan in it,1
6421,what redeems the film is the cast particularly the yayas themselves,3
6422,but what is nice is that there is a casual intelligence that permeates the script,4
6423,adam sandler s 8 crazy nights is 75 wasted minutes of sandler as the voiceover hero in columbia pictures perverse idea of an animated holiday movie,1
6424,a mess,1
6425,the filmmakers wisely decided to let crocodile hunter steve irwin do what he does best and fashion a story around him,3
6426,so purely enjoyable that you might not even notice it is a fairly straightforward remake of hollywood comedies such as father of the bride,3
6427,talk to her is so darned assured we have absolutely no idea who the main characters are until the film is well under way and yet it is hard to stop watching,3
6428,a genuinely funny ensemble comedy that also asks its audience in a heartwarming nonjudgmental kind of way to consider what we value in our daily lives,4
6429,it is so laddish and juvenile only teenage boys could possibly find it funny,2
6430,after seeing analyze that i feel better already,3
6431,mazel tov to a film about a family s joyous life acting on the yiddish stage,4
6432,the characters are never more than sketches which leaves any true emotional connection or identification frustratingly out of reach,0
6433,reign of fire just might go down as one of the alltime great apocalypse movies,3
6434,visually sumptuous but intellectually stultifying,2
6435,though few will argue that it ranks with the best of herzog s works invincible shows he is back in form with an astoundingly rich film,4
6436,the simplicity of the way home has few equals this side of aesop,2
6437,monte cristo smartly emphasizes the wellwrought story and omits needless chase scenes and swordfights as the revenge unfolds,4
6438,it shows us a slice of life that is very different from our own and yet instantly recognizable,3
6439,a fine film but it would be a lot better if it stuck to betty fisher and left out the other stories,2
6440,interesting both as a historical study and as a tragic love story,3
6441,feels untidily honest,2
6442,what we have here is nt a disaster exactly but a very handsomely produced letdown,1
6443,there is a reason the studio did nt offer an advance screening,1
6444,there is a certain sense of experimentation and improvisation to this film that may not always work but it is nevertheless compelling,3
6445,though it is equally solipsistic in tone the movie has enough vitality to justify the notion of creating a screen adaptation of evans saga of hollywood excess,3
6446,one of the worst films of 2002,0
6447,the film s overall mood and focus is interesting but constantly unfulfilling,2
6448,lazy miserable and smug,0
6449,lrb t rrb he script is nt up to the level of the direction nor are the uneven performances by the cast members who seem bound and determined to duplicate bela lugosi s nowcliched vampire accent,1
6450,often demented in a good way but it is an uneven film for the most part,1
6451,i wish windtalkers had had more faith in the dramatic potential of this true story,2
6452,an animation landmark as monumental as disney s 1937 breakthrough snow white and the seven dwarfs,4
6453,this thing is just garbage,0
6454,the road paved with good intentions leads to the video store,3
6455,still this flick is fun and host to some truly excellent sequences,4
6456,a disoriented but occasionally disarming saga packed with moments out of an alice in wonderland adventure a stalker thriller and a condensed season of tv s big brother,3
6457,juwanna mann,2
6458,like the world of his film hartley created a monster but did nt know how to handle it,1
6459,what is surprising is how well it holds up in an era in which computergenerated images are the norm,3
6460,it is a cleareyed portrait of an intensely lived time filled with nervous energy moral ambiguity and great uncertainties,3
6461,the extent to which it succeeds is impressive,3
6462,proves a servicable world war ii drama that ca nt totally hide its contrivances but it at least calls attention to a problem hollywood too long has ignored,3
6463,tobey maguire is a poster boy for the geek generation,2
6464,a fascinating bombshell documentary that should shame americans regardless of whether or not ultimate blame finally lies with kissinger,4
6465,never inspires more than an interested detachment,1
6466,ultimately clarity matters both in breaking codes and making movies,2
6467,a sharp and quick documentary that is funny and pithy while illuminating an era of theatrical comedy that while past really is nt,3
6468,this is a smart movie that knows its classical music knows its freud and knows its sade,3
6469,instead of trying to bust some blondes lrb diggs rrb should be probing why a guy with his talent ended up in a movie this bad,1
6470,a film that presents an interesting even sexy premise then ruins itself with too many contrivances and goofy situations,2
6471,delivers roughly equal amounts of beautiful movement and inside information,3
6472,meyjes s movie like max rothman s future does not work,1
6473,a weird arresting little ride,3
6474,but i had a lot of problems with this movie,1
6475,a dopey movie clothed in excess layers of hipness,2
6476,it is dull spiritless silly and monotonous an ultraloud blast of pointless mayhem going nowhere fast,0
6477,the year 2002 has conjured up more comingofage stories than seem possible but take care of my cat emerges as the very best of them,4
6478,nakata s technique is to imply terror by suggestion rather than the overuse of special effects,3
6479,but it does nt need gangs of new york,2
6480,the cinematic equivalent of patronizing a bar favored by pretentious untalented artistes who enjoy moaning about their cruel fate,1
6481,there is a part of us that can not help be entertained by the sight of someone getting away with something,3
6482,but mr polanski creates images even more haunting than those in mr spielberg s 1993 classic,4
6483,the performances are strong though the subject matter demands acting that borders on hammy at times,3
6484,never does lilo stitch reach the emotion or timelessness of disney s great past or even that of more recent successes such as mulan or tarzan,1
6485,a wild ride with eight boarders from venice beach that was a deserved cowinner of the audience award for documentaries at the sundance film festival,4
6486,the mushy finale turns john q into a movieoftheweek tearjerker,3
6487,a venturesome beautifully realized psychological mood piece that reveals its firsttime feature director s understanding of the expressive power of the camera,4
6488,that it will probably be the best and most mature comedy of the 2002 summer season speaks more of the season than the picture,3
6489,it is still adam sandler and it is not little nicky,2
6490,your nightmares on the other hand will be anything but,2
6491,my own minority report is that it stinks,0
6492,cage makes an unusual but pleasantly haunting debut behind the camera,3
6493,brosnan is more feral in this film than i have seen him before and halle berry does her best to keep up with him,3
6494,ben kingsley is truly funny playing a kind of ghandi gone bad,4
6495,frankly it is pretty stupid,1
6496,ozpetek s effort has the scope and shape of an especially wellexecuted television movie,4
6497,too clever by about ninetenths,3
6498,you should pay nine bucks for this because you can hear about suffering afghan refugees on the news and still be unaffected,2
6499,the whole mildly pleasant outing the r rating is for brief nudity and a grisly corpse remains aloft not on its own selfreferential hot air but on the inspired performance of tim allen,2
6500,horns and halos benefits from serendipity but also reminds us of our own responsibility to question what is told as the truth,3
6501,a particularly joyless and exceedingly dull period comingofage tale,0
6502,an unorthodox little film noir organized crime story that includes one of the strangest love stories you will ever see,3
6503,watching the powerpuff girls movie my mind kept returning to one anecdote for comparison the cartoon in japan that gave people seizures,3
6504,there is no good answer to that one,1
6505,lrb while the last metro rrb was more melodramatic confined to a single theater company and its strategies and deceptions while tavernier is more concerned with the entire period of history,3
6506,cantet beautifully illuminates what it means sometimes to be inside looking out and at other times outside looking in,3
6507,if you think it is a riot to see rob schneider in a young woman s clothes then you will enjoy the hot chick,3
6508,with the same sort of goodnatured fun found in films like tremors eight legged freaks is prime escapist fare,4
6509,a bore that tends to hammer home every one of its points,1
6510,a nonmystery mystery,1
6511,there is backstabbing interracial desire and most importantly singing and dancing,3
6512,there is more repetition than creativity throughout the movie,1
6513,together miller kuras and the actresses make personal velocity into an intricate intimate and intelligent journey,3
6514,i enjoyed the movie in a superficial way while never sure what its purpose was,3
6515,the film sometimes flags but there is enough secondary action to keep things moving along at a brisk amusing pace,2
6516,fear dot com is more frustrating than a modem that disconnects every 10 seconds,1
6517,often overwrought and at times positively irritating the film turns into an engrossing thriller almost in spite of itself,2
6518,instead of a witty expose on the banality and hypocrisy of too much kidvid we get an ugly meanspirited lashing out by an adult who is apparently been forced by his kids to watch too many barney videos,1
6519,feels like the work of an artist who is simply tired of fighting the same fights of putting the weight of the world on his shoulders of playing with narrative form,1
6520,it is very difficult to care about the character and that is the central flaw of the film,0
6521,gangster no 1 is solid satisfying fare for adults,4
6522,why did they deem it necessary to document all this emotional misery,1
6523,no doubt the star and everyone else involved had their hearts in the right place,3
6524,lrb rises rrb above its ohsohollywood rejiggering and its conventional direction to give the film a soul and an unabashed sense of good oldfashioned escapism,3
6525,newcomer helmer kevin donovan is hamstrung by a badly handled screenplay of what is really an amusing concept a hightech tux that transforms its wearer into a superman,2
6526,this is the first film i have ever seen that had no obvious directing involved,2
6527,captures that perverse element of the kafkaesque where identity overnight is robbed and replaced with a persecuted other,3
6528,never once predictable,3
6529,the film does nt really care about the thousands of americans who die hideously it cares about how ryan meets his future wife and makes his start at the cia,1
6530,offers a guiltfree trip into feelgood territory,4
6531,the filmmakers are playing to the big boys in new york and la to that end they mock the kind of folks they do nt understand ones they figure the powerlunchers do nt care to understand either,1
6532,i wish it would have just gone more overthetop instead of trying to have it both ways,1
6533,the whole affair true story or not feels incredibly hokey lrb it rrb comes off like a hallmark commercial,1
6534,lrb allen s rrb been making piffle for a long while and hollywood ending may be his way of saying that piffle is all that the airhead movie business deserves from him right now,2
6535,cacoyannis is perhaps too effective in creating an atmosphere of dustcaked stagnation and labored gentility,2
6536,the structure is simple but in its own way rabbitproof fence is a quest story as grand as the lord of the rings,3
6537,ok not really,2
6538,a puppy dog so desperate for attention it nearly breaks its little neck trying to perform entertaining tricks,1
6539,nice piece of work,3
6540,lrb kirshner wins but it is close rrb,2
6541,a road trip that will get you thinking are we there yet,2
6542,the events of the film are just so weird that i honestly never knew what the hell was coming next,1
6543,the ring is worth a look if you do nt demand much more than a few cheap thrills from your halloween entertainment,2
6544,who knew,2
6545,episode ii attack of the clones is a technological exercise that lacks juice and delight,1
6546,this is a dark gritty sometimes funny little gem,3
6547,though there is a clarity of purpose and evenhandedness to the film s direction the drama feels rigged and sluggish,1
6548,noyce s greatest mistake is thinking that we needed sweeping dramatic hollywood moments to keep us,1
6549,the country bears has no scenes that will upset or frighten young viewers,2
6550,what emerges is an unsettling picture of childhood innocence combined with indoctrinated prejudice,3
6551,the 3d vistas from orbit with the space station suspended like a huge set of wind chimes over the great blue globe are stanzas of breathtaking aweinspiring visual poetry,4
6552,cacoyannis vision is far less mature interpreting the play as a call for pity and sympathy for anachronistic phantasms haunting the imagined glory of their own pasts,1
6553,jackie chan movies are a guilty pleasure he is easy to like and always leaves us laughing,3
6554,lrb gayton s script rrb telegraphs every discovery and layers on the gloss of convenience,3
6555,i know i should nt have laughed but hey those farts got to my inner nineyearold,3
6556,has about 34th the fun of its spry 2001 predecessor but it is a rushed slapdash sequelforthesake ofasequel with less than half the plot and ingenuity,0
6557,there is a general air of exuberance in all about the benjamins that is hard to resist,3
6558,plays like one of those conversations that comic book guy on the simpsons has,1
6559,a shanana sketch punctuated with graphic violence,2
6560,a drama,2
6561,dong never pushes for insights beyond the superficial tensions of the dynamic he is dissecting and the film settles too easily along the contours of expectation,1
6562,this charming but slight tale has warmth wit and interesting characters compassionately portrayed,3
6563,the movie slides downhill as soon as macho action conventions assert themselves,0
6564,streamlined to a tight brisk 85minute screwball thriller big trouble is funny harmless and as substantial as a tub of popcorn with extra butter,2
6565,as it stands there is some fine sex onscreen and some tense arguing but not a whole lot more,2
6566,delightfully rendered,4
6567,shows that jackie chan is getting older and that is something i would rather live in denial about,1
6568,many insightful moments,3
6569,it is a movie about passion,2
6570,made to be jaglomized is the cannes film festival the annual riviera spree of flesh buzz blab and money,1
6571,the performances are immaculate with roussillon providing comic relief,4
6572,anyone not into hightech splatterfests is advised to take the warning literally and log on to something more userfriendly,1
6573,director claude chabrol has become the master of innuendo,3
6574,as comedic spotlights go notorious cho hits all the verbal marks it should,3
6575,lrb tries rrb to parody a genre that is already a joke in the united states,1
6576,they were afraid to show this movie to reviewers before its opening afraid of the bad reviews they thought they would earn,0
6577,especially give credit to affleck,4
6578,a fragile framework upon which to hang broad mildly fleshedout characters that seem to have been conjured up only 10 minutes prior to filming,1
6579,and it marks him as one of the most interesting writerdirectors working today,3
6580,this picture is murder by numbers and as easy to be bored by as your abc s despite a few whopping shootouts,0
6581,though jones and snipes are enthralling the movie bogs down in rhetoric and clich,1
6582,according to wendigo nature loves the members of the upper class almost as much as they love themselves,3
6583,even a hardened voyeur would require the patience of job to get through this interminable shapeless documentary about the swinging subculture,0
6584,it is refreshingly undogmatic about its characters,4
6585,a gratingly unfunny groaner littered with zerodimensional unlikable characters and hackneyed threadbare comic setups,0
6586,a vibrant colorful semimusical rendition,4
6587,but as you watch the movie you are too interested to care,4
6588,a mediocre exercise in target demographics unaware that it is the butt of its own joke,1
6589,the funny thing is i did nt mind all this contrived nonsense a bit,2
6590,thumbs down,0
6591,while the story does seem pretty unbelievable at times it is awfully entertaining to watch,3
6592,at a time when we have learned the hard way just how complex international terrorism is collateral damage paints an absurdly simplistic picture,1
6593,adam sandler,2
6594,upper west sidey exercise in narcissism and selfcongratulation disguised as a tribute,1
6595,as a kind of colorful dramatized pbs program frida gets the job done,3
6596,an uneven look into a grim future that does nt come close to the level of intelligence and visual splendour that can be seen in other films based on philip k dick stories,1
6597,lrb shyamalan rrb turns the goosepimple genre on its empty head and fills it with spirit purpose and emotionally bruised characters who add up to more than body count,3
6598,totally overwrought deeply biased and wholly designed to make you feel guilty about ignoring what the filmmakers clearly believe are the greatest musicians of all time,0
6599,there is so much to look at in metropolis you hate to tear your eyes away from the images long enough to read the subtitles,4
6600,woody allen used to ridicule movies like hollywood ending,1
6601,either a fascinating study of the relationship between mothers and their children or a disturbing story about sociopaths and their marks,2
6602,lightweight but appealing,3
6603,there is nothing redeeming about this movie,0
6604,what is infuriating about full frontal is that it is too close to real life to make sense,1
6605,touch,2
6606,the movie s seams may show but pellington gives mothman an irresistibly uncanny ambience that goes a long way toward keeping the picture compelling,3
6607,macdowell gives give a solid anguished performance that eclipses nearly everything else she is ever done,4
6608,director paul cox s unorthodox abstract approach to visualizing nijinsky s diaries is both stimulating and demanding,3
6609,the sight of the spaceship on the launching pad is duly impressive in imax dimensions as are shots of the astronauts floating in their cabins,3
6610,the unique niche of selfcritical behindthescenes navelgazing kaufman has carved from orleans story and his own infinite insecurity is a work of outstanding originality,4
6611,the stunt work is topnotch the dialogue and drama often foodspittingly funny,3
6612,lucas has in fact come closer than anyone could desire to the cheap graceless hackneyed scifi serials of the 30s and 40s,1
6613,a fine effort an interesting topic some intriguing characters and a sad ending,3
6614,something appears to have been lost in the translation this time,0
6615,featherweight romantic comedy has a few nice twists in a standard plot and the charisma of hugh grant and sandra bullock,3
6616,hypnotically dull relentlessly downbeat laughably predictable wail pitched to the cadence of a depressed fifteenyearold s suicidal poetry,0
6617,everything about the quiet american is good except its timing,3
6618,it is a smartly directed grownup film of ideas,4
6619,the bourne identity should nt be half as entertaining as it is but director doug liman and his colleagues have managed to pack it with enough action to satisfy the boombam crowd without a huge sacrifice of character and mood,3
6620,once he starts learning to compromise with reality enough to become comparatively sane and healthy the film becomes predictably conventional,1
6621,a touching smallscale story of family responsibility and care in the community,3
6622,the gifted crudup has the perfect face to play a handsome blank yearning to find himself and his cipherlike personality and bad behavior would play fine if the movie knew what to do with him,1
6623,an artsploitation movie with too much exploitation and too little art,0
6624,an unflinching look at the world s dispossessed,2
6625,unless you are a fanatic the best advice is scooby do nt,1
6626,nicole kidman evolved from star to superstar some time over the past year which means that birthday girl is the kind of quirkily appealing minor movie she might not make for a while,3
6627,and the positive change in tone here seems to have recharged him,3
6628,the culmination of everyone s efforts is given life when a selection appears in its final form lrb in last dance rrb,2
6629,there is just something about watching a squad of psychopathic underdogs whale the tar out of unsuspecting lawmen that reaches across time and distance,3
6630,the script is high on squaddie banter low on shocks,3
6631,go back to sleep,1
6632,this movie plays like an extended dialogue exercise in retard 101,0
6633,the movie is gorgeously made but it is also somewhat shallow and artconscious,2
6634,it is as if a bored cage spent the duration of the film s shooting schedule waiting to scream got aids yet,0
6635,secret ballot is a funny puzzling movie ambiguous enough to be engaging and oddly moving,4
6636,a visionary marvel but it is lacking a depth in storytelling usually found in anime like this,1
6637,nair just does nt have the necessary selfcontrol to guide a loose poorly structured film through the pitfalls of incoherence and redundancy,0
6638,one of the most slyly exquisite antiadult movies ever made,4
6639,this lowrent and even lowerwit ripoff of the farrelly brothers oeuvre gets way too mushy and in a relatively short amount of time,1
6640,happily stays close to the ground in a spare and simple manner and does nt pummel us with phony imagery or music,4
6641,fails as a dystopian movie as a retooling of fahrenheit 451 and even as a ripoff of the matrix,0
6642,whatever one makes of its political edge this is beautiful filmmaking from one of french cinema s master craftsmen,4
6643,jagger stoppard and director michael apted deliver a riveting and surprisingly romantic ride,4
6644,banal and predictable,0
6645,takes a clunky tvmovie approach to detailing a chapter in the life of the celebrated irish playwright poet and drinker,1
6646,ritchie may not have a novel thought in his head but he knows how to pose madonna,2
6647,the trashy teensleaze equivalent of showgirls,1
