,text,label
1951,no amount of nostalgia for carvey s glory days can disguise the fact that the new film is a lame kiddie flick and that carvey s considerable talents are wasted in it,0
1952,consistently clever and suspenseful,4
1953,this is an ungainly movie illfitting with its elbows sticking out where the knees should be,0
1954,a real audiencepleaser that will strike a chord with anyone who is ever waited in a doctor s office emergency room hospital bed or insurance company office,3
1955,if you like me think an action film disguised as a war tribute is disgusting to begin with then you are in for a painful ride,0
1956,if you are as happy listening to movies as you are watching them and the slow parade of human frailty fascinates you then you are at the right film,3
1957,one funny popcorn flick,3
1958,bad company has one of the most moronic screenplays of the year full of holes that will be obvious even to those who are nt looking for them,1
1959,i would be hard pressed to think of a film more cloyingly sappy than evelyn this year,1
1960,a gem of a romantic crime comedy that turns out to be clever amusing and unpredictable,4
1961,smith finds amusing juxtapositions that justify his exercise,3
1962,a charming banterfilled comedy one of those airy cinematic bon bons whose aims and by extension accomplishments seem deceptively slight on the surface,3
1963,it is that rare family movie genuine and sweet without relying on animation or dumb humor,4
1964,hollywood ending is the most disappointing woody allen movie ever,0
1965,it is mildly amusing but i certainly ca nt recommend it,1
1966,this dreadfully earnest inversion of the concubine love triangle eschews the previous film s historical panorama and roiling pathos for bugeyed mugging and gayniche condescension,1
1967,formula 51 promises a new kind of high but delivers the same old bad trip,1
1968,for a movie audience the hours does nt connect in a neat way but introduces characters who illuminate mysteries of sex duty and love,2
1969,what madonna does here ca nt properly be called acting more accurately it is moving and it is talking and it is occasionally gesturing sometimes all at once,1
1970,rifkin s references are impeccable throughout,4
1971,insomnia does not become one of those rare remakes to eclipse the original but it does nt disgrace it either,2
1972,the director explores all three sides of his story with a sensitivity and an inquisitiveness reminiscent of truffaut,3
1973,the fact that the best part of the movie comes from a 60second homage to one of demme s good films does nt bode well for the rest of it,1
1974,an enjoyable comedy of lingual and cultural differences the chteau is a film full of life and small delights that has all the wiggling energy of young kitten,4
1975,try hell house which documents the cautionary christian spookarama of the same name,2
1976,tennessee williams by way of oprah s book club,2
1977,an engaging formulaic sports drama that carries a charge of genuine excitement,3
1978,something must have been lost in the translation,1
1979,witty contemplative and sublimely beautiful,4
1980,foster and whitaker are especially fine,4
1981,the lightest most breezy movie steven spielberg has made in more than a decade,3
1982,if i want a real movie i will buy the criterion dvd,1
1983,an earnest roughshod document it serves as a workable primer for the region s recent history and would make a terrific 10thgrade learning tool,3
1984,a conventional but heartwarming tale,4
1985,a sly female empowerment movie although not in a way anyone would expect,3
1986,there are a few modest laughs but certainly no thrills,2
1987,the problem is the needlessly poor quality of its archival prints and film footage,0
1988,there is something unintentionally comic in the film s drumbeat about authenticity given the stale plot and pornographic way the film revels in swank apartments clothes and parties,1
1989,strange occurrences build in the mind of the viewer and take on extreme urgency,3
1990,almost everything about the film is unsettling from the preposterous hairpiece worn by lai s villainous father to the endless action sequences,2
1991,it wo nt harm anyone but neither can i think of a very good reason to rush right out and see it,2
1992,the formula is familiar but enjoyable,3
1993,its screenplay serves as autocritique and its clumsiness as its own most damning censure,1
1994,less an examination of neonazism than a probe into the nature of faith itself,3
1995,good performances and a realistic nonexploitive approach make paid in full worth seeing,4
1996,the trinity assembly approaches the endeavor with a shocking lack of irony and george ratliff s documentary hell house reflects their earnestness which makes for a terrifying film,2
1997,just is nt as weird as it ought to be,1
1998,if you love the music and i do its hard to imagine having more fun watching a documentary,4
1999,watching queen of the damned is like reading a research paper with special effects tossed in,1
2000,stinks from start to finish like a wet burlap sack of gloom,1
2001,the merchantivory team continues to systematically destroy everything we hold dear about cinema only now it is begun to split up so that it can do even more damage,1
2002,while there are times when the film s reach exceeds its grasp the production works more often than it does nt,3
2003,hugely accomplished slice of hitchcockian suspense,3
2004,exhibits the shallow sensationalism characteristic of soap opera more salacious telenovela than serious drama,1
2005,i am sure there is a teenage boy out there somewhere who is dying for this kind of entertainment,1
2006,why sit through a crummy wannabehip crime comedy that refers incessantly to old movies when you could just rent those movies instead let alone seek out a respectable new one,0
2007,a thoroughly awful movie dumb narratively chaotic visually sloppy a weird amalgam of the thing and a geriatric scream,0
2008,contains the humor characterization poignancy and intelligence of a bad sitcom,1
2009,laughably irredeemably awful,0
2010,one long numbing action sequence made up mostly of routine stuff yuen has given us before,1
2011,together lrb time out and human resources rrb establish mr cantet as france s foremost cinematic poet of the workplace,3
2012,a gleefully grungy hilariously wicked black comedy,4
2013,everything its title implies a standardissue crime drama spat out from the tinseltown assembly line,2
2014,with spy kids 2 the island of lost dreams the spy kids franchise establishes itself as a durable part of the movie landscape a james bond series for kids,3
2015,reno himself can take credit for most of the movie s success,3
2016,boldly engineering a collision between tawdry bmovie flamboyance and grandiose spiritual anomie rose s film true to its source material provides a tenacious demonstration of death as the great equalizer,2
2017,outside of burger s desire to make some kind of film it is really unclear why this project was undertaken,1
2018,as for children they wo nt enjoy the movie at all,1
2019,if you saw it on tv you would probably turn it off convinced that you had already seen that movie,1
2020,while it is interesting to witness the conflict from the palestinian side longley s film lacks balance and fails to put the struggle into meaningful historical context,1
2021,journalistically dubious inept and often lethally dull,0
2022,brilliantly written and wellacted yellow asphalt is an uncompromising film,4
2023,like mike is nt going to make box office money that makes michael jordan jealous but it has some cute moments funny scenes and hits the target audience lrb young bow wow fans rrb with nothing but net,3
2024,exposing the ways we fool ourselves is one hour photo s real strength,2
2025,the gags that fly at such a furiously funny pace that the only rip off that we were aware of was the one we felt when the movie ended so damned soon,4
2026,while the path may be familiar firsttime director denzel washington and a topnotch cast manage to keep things interesting,3
2027,standing in the shadows of motown is the best kind of documentary one that makes a depleted yesterday feel very much like a brandnew tomorrow,4
2028,the filmmaker s heart is in the right place,2
2029,a series of escapades demonstrating the adage that what is good for the goose is also good for the gander some of which occasionally amuses but none of which amounts to much of a story,1
2030,j lo will earn her share of the holiday box office pie although this movie makes one thing perfectly clear she is a pretty woman but she is no working girl,3
2031,this documentary is a dazzling remarkably unpretentious reminder of what lrb evans rrb had lost and got back,4
2032,their work is fantastic,4
2033,much of the movie s charm lies in the utter cuteness of stuart and margolo,3
2034,looks and feels like a lowbudget hybrid of scarface or carlito s way,1
2035,a profoundly stupid affair populating its hackneyed and meanspirited storyline with cardboard characters and performers who value cash above credibility,0
2036,like its script which nurses plot holes gaping enough to pilot an entire olympic swim team through the characters in swimfan seem motivated by nothing short of dull braindeadening hangover,1
2037,jonah is only soso the addition of a biblical message will either improve the film for you or it will lessen it,2
2038,do we really need the tiger beat version,1
2039,if it is unnerving suspense you are after you will find it with ring an indisputably spooky film with a screenplay to die for,3
2040,gosling creates a staggeringly compelling character a young man whose sharp intellect is at the very root of his contradictory selfhating selfdestructive ways,4
2041,a beautiful paean to a time long past,3
2042,a highly personal look at the effects of living a dysfunctionally privileged lifestyle and by the end we only wish we could have spent more time in its world,2
2043,an extremely funny ultimately heartbreaking look at life in contemporary china,3
2044,sheds light on a subject few are familiar with and makes you care about music you may not have heard before,3
2045,bad in such a bizarre way that it is almost worth seeing if only to witness the crazy confluence of purpose and taste,2
2046,an ambitious and moving but bleak film,2
2047,but for the most part the weight of water comes off as a twoway timeswitching myopic mystery that stalls in its lackluster gear of emotional blandness,1
2048,and diesel is nt the actor to save it,1
2049,only those most addicted to film violence in all its forms will find anything here to appreciate,2
2050,a feeble tootsie knockoff,1
2051,see it for his performance if nothing else,3
2052,terrific casting and solid execution give all three stories life,3
2053,the skirmishes for power waged among victims and predators settle into an undistinguished rhythm of artificial suspense,1
2054,a thriller without a lot of thrills,0
2055,yet the act is still charming here,3
2056,strictly middle of the road,2
2057,far more enjoyable than its predecessor,4
2058,i was sent a copyof this film to review on dvd,2
2059,a moving essay about the specter of death especially suicide,3
2060,phillip noyce and all of his actors as well as his cinematographer christopher doyle understand the delicate forcefulness of greene s prose and it is there on the screen in their version of the quiet american,3
2061,though it runs 163 minutes safe conduct is anything but languorous,3
2062,barry sonnenfeld owes frank the pug big time,2
2063,this is the kind of movie that you only need to watch for about thirty seconds before you say to yourself ah yes here we have a bad bad bad movie,0
2064,even at its worst it is not halfbad,3
2065,even if you have never heard of chaplin you will still be glued to the screen,4
2066,a long dull procession of despair set to cello music culled from a minimalist funeral,0
2067,i would be shocked if there was actually one correct interpretation but that should nt make the movie or the discussion any less enjoyable,2
2068,the concert footage is stirring the recording sessions are intriguing and on the way to striking a blow for artistic integrity this quality band may pick up new admirers,3
2069,most of the dialogue made me want to pack raw dough in my ears,0
2070,vividly conveys the shadow side of the 30year friendship between two english women,2
2071,queen of the damned is too long with too little going on,1
2072,whatever about warning kids about the dangers of ouija boards someone should dispense the same advice to film directors,2
2073,the sound of gunfire and cell phones ringing,2
2074,it ai nt art by a long shot but unlike last year s lame musketeer this dumas adaptation entertains,3
2075,campanella s competent direction and his excellent cast overcome the obstacles of a predictable outcome and a screenplay that glosses over rafael s evolution,3
2076,schtte s dramatic snapshot of the artist three days before his death offers an interesting bit of speculation as to the issues brecht faced as his life drew to a close,3
2077,would be an unendurable viewing experience for this ultraprovincial new yorker if 26yearold reese witherspoon were not on hand to inject her pure fantasy character melanie carmichael with a massive infusion of oldfashioned hollywood magic,3
2078,a horror movie with seriously dumb characters which somewhat dilutes the pleasure of watching them stalked by creepycrawly bug things that live only in the darkness,1
2079,their parents would do well to cram earplugs in their ears and put pillowcases over their heads for 87 minutes,0
2080,cloaks a familiar antifeminist equation lrb career kids misery rrb in tiresome romanticcomedy duds,1
2081,naomi watts is terrific as rachel her petite frame and vulnerable persona emphasising her plight and isolation,3
2082,idiotic and ugly,0
2083,film aficionados can not help but love cinema paradiso whether the original version or new director s cut,3
2084,if you can keep your eyes open amid all the blood and gore you will see del toro has brought unexpected gravity to blade ii,2
2085,hard endearing caring warm,4
2086,the major problem with windtalkers is that the bulk of the movie centers on the wrong character,1
2087,greaseballs mob actioncomedy,1
2088,visually exciting scifi film which suffers from a lackluster screenplay,2
2089,writer and director otar iosseliani s pleasant tale about a factory worker who escapes for a holiday in venice reveals how we all need a playful respite from the grind to refresh our souls,4
2090,a refreshingly realistic affectationfree comingofage tale,4
2091,simone is a fun and funky look into an artificial creation in a world that thrives on artificiality,4
2092,is truth stranger than fiction,2
2093,supposedly pokemon ca nt be killed but pokemon 4ever practically assures that the pocket monster movie franchise is nearly ready to keel over,1
2094,the acting is amateurish the cinematography is atrocious the direction is clumsy the writing is insipid and the violence is at once luridly graphic and laughably unconvincing,0
2095,it is the type of stunt the academy loves a powerful political message stuffed into an otherwise mediocre film,2
2096,you have to see it,4
2097,pray has really done his subject justice,3
2098,some elements of it really blow the big one but other parts are decent,2
2099,will you go ape over this movie,2
2100,the implication is kissinger may have decided that when it comes to truncheoning it is better to give than to receive,2
2101,woody what happened,1
2102,but it is also disappointing to a certain degree,1
2103,coarse cliched and clunky this trifling romantic comedy in which opposites attract for no better reason than that the screenplay demands it squanders the charms of stars hugh grant and sandra bullock,0
2104,bears about as much resemblance to the experiences of most battered women as spiderman does to the experiences of most teenagers,1
2105,at times a bit melodramatic and even a little dated lrb depending upon where you live rrb ignorant fairies is still quite goodnatured and not a bad way to spend an hour or two,3
2106,a boring masquerade ball where normally good actors even kingsley are made to look bad,1
2107,a semiautobiographical film that is so sloppily written and cast that you can not believe anyone more central to the creation of bugsy than the caterer had anything to do with it,0
2108,the skills of a calculus major at mit are required to balance all the formulaic equations in the longwinded heist comedy who is cletis tout,1
2109,though there are entertaining and audacious moments the movie s wildly careening tone and an extremely flat lead performance do little to salvage this filmmaker s flailing reputation,1
2110,efteriades gives the neighborhood scenery vibe and all the cinematic equivalent of a big tender hug,3
2111,two weeks notice has appeal beyond being a sandra bullock vehicle or a standard romantic comedy,3
2112,could use a little more humanity but it never lacks in eyepopping visuals,3
2113,the leads are natural and lovely the pace is serene the humor wry and sprightly,4
2114,offers big fat dumb laughs that may make you hate yourself for giving in,1
2115,hardly a film that comes along every day,3
2116,definitely worth 95 minutes of your time,4
2117,certainly the big finish was nt something galinsky and hawley could have planned for but part of being a good documentarian is being there when the rope snaps,3
2118,rollerball is as bad as you think and worse than you can imagine,0
2119,there is the plot and a maddeningly insistent and repetitive piano score that made me want to scream,1
2120,it would be great to see this turd squashed under a truck preferably a semi,0
2121,it is all about the image,2
2122,the pacing is deadly the narration helps little and naipaul a juicy writer is negated,0
2123,this may be dover kosashvili s feature directing debut but it looks an awful lot like life gritty awkward and ironic,2
2124,i am going to give it a marginal thumbs up,3
2125,this beautifully animated epic is never dull,4
2126,human nature in short is nt nearly as funny as it thinks it is neither is it as smart,1
2127,davis gets vivid performances from her cast and pulls off some deft ally mcbealstyle fantasy sequences,4
2128,even in the summertime the most restless young audience deserves the dignity of an action hero motivated by something more than franchise possibilities,1
2129,an enigmatic film that is too clever for its own good it is a conundrum not worth solving,2
2130,neither a rousing success nor a blinding embarrassment,2
2131,a mesmerizing cinematic poem from the first frame to the last,4
2132,the setting turns out to be more interesting than any of the character dramas which never reach satisfying conclusions,1
2133,this painfully unfunny farce traffics in tired stereotypes and encumbers itself with complications that have no bearing on the story,0
2134,take nothing seriously and enjoy the ride,3
2135,any intellectual arguments being made about the nature of god are framed in a drama so clumsy there is a real danger less sophisticated audiences will mistake it for an endorsement of the very things that bean abhors,2
2136,it is different from others in its genre in that it is does not rely on dumb gags anatomical humor or character cliches it primarily relies on character to tell its story,4
2137,still rapturous after all these years cinema paradiso stands as one of the great films about movie love,4
2138,be patient with the lovely hush,3
2139,the actors are simply too good and the story too intriguing for technical flaws to get in the way,4
2140,i would be lying if i said my ribcage did nt ache by the end of kung pow,3
2141,it may also be the best sex comedy about environmental pollution ever made,4
2142,an entertaining if ultimately minor thriller,3
2143,and the reason for that is a selfaware often selfmocking intelligence,3
2144,whether jason x is this bad on purpose is never clear,0
2145,all comedy is subversive but this unrelenting bleak insistence on opting out of any opportunity for finding meaning in relationships or work just becomes sad,0
2146,the movie is concocted and carried out by folks worthy of scorn and the nicest thing i can say is that i ca nt remember a single name responsible for it,0
2147,all too familiar basically the sort of cautionary tale that was old when angels with dirty faces appeared in 1938,1
2148,seems like something american and european gay movies were doing 20 years ago,1
2149,this is a truly truly bad movie,1
2150,the way the roundelay of partners functions and the interplay within partnerships and among partnerships and the general air of gatorbashing are consistently delightful,4
2151,both flawed and delayed martin scorcese s gangs of new york still emerges as his most vital work since goodfellas,2
2152,what blade runner would have looked like as a lowbudget series on a uhf channel,1
2153,there is a difference between movies with the courage to go over the top and movies that do nt care about being stupid,1
2154,an ebullient tunisian film about the startling transformation of a traditionbound widow who is drawn into the exotic world of belly dancing,3
2155,a lovely film for the holiday season,3
2156,ice age treads predictably along familiar territory making it a passable family film that wo nt win many fans over the age of 12,2
2157,after one gets the feeling that the typical hollywood disregard for historical truth and realism is at work here it is a matter of finding entertainment in the experiences of zishe and the fiery presence of hanussen,3
2158,tadpole may be one of the most appealing movies ever made about an otherwise appalling and downright creepy subject a teenage boy in love with his stepmother,3
2159,a film centering on a traditional indian wedding in contemporary new delhi may not sound like specialized fare but mira nair s film is an absolute delight for all audiences,4
2160,when you think you have figured out bielinsky s great game that is when you are in the most trouble he is the con and you are just the mark,2
2161,the most amazing supersized dosage of goofball stunts any jackass fan could want,4
2162,k19 the widowmaker is derivative overlong and bombastic yet surprisingly entertaining,3
2163,every visual joke is milked every setup obvious and lengthy every punchline predictable,1
2164,by that measure it is a failure,0
2165,rather than real figures elling and kjell bjarne become symbolic characters whose actions are supposed to relate something about the naf s encounter with the world,1
2166,seeing as the film lacks momentum and its position remains mostly undeterminable the director s experiment is a successful one,3
2167,a pretentious mess,0
2168,full of flatulence jokes and mild sexual references kung pow,1
2169,13 conversations holds its goodwill close but is relatively slow to come to the point,2
2170,so mindnumbingly awful that you hope britney wo nt do it one more time as far as movies are concerned,1
2171,laced with liberal doses of dark humor gorgeous exterior photography and a stablefull of solid performances no such thing is a fascinating little tale,4
2172,in the new release of cinema paradiso the tale has turned from sweet to bittersweet and when the tears come during that final beautiful scene they finally feel absolutely earned,4
2173,remove spiderman the movie from its red herring surroundings and it is apparent that this is one summer film that satisfies,3
2174,spectators will indeed sit openmouthed before the screen not screaming but yawning,1
2175,the sum of all fears is simply a wellmade and satisfying thriller,4
2176,lrb raimi s rrb matured quite a bit with spiderman even though it is one of the most plain white toast comic book films you will ever see,2
2177,what makes the movie special is its utter sincerity,3
2178,the thing just never gets off the ground,0
2179,after several scenes of this tacky nonsense you will be wistful for the testosteronecharged wizardry of jerry bruckheimer productions especially because half past dead is like the rock on a walmart budget,0
2180,the film oozes craft,3
2181,once the expectation of laughter has been quashed by whatever obscenity is at hand even the funniest idea is nt funny,0
2182,funny sexy devastating and incurably romantic,4
2183,eastwood winces clutches his chest and gasps for breath,2
2184,and how,2
2185,an ambitious guiltsuffused melodrama crippled by poor casting,1
2186,not one moment in the enterprise did nt make me want to lie down in a dark room with something cool to my brow,2
2187,norton holds the film together,2
2188,this is an exercise not in biography but in hero worship,1
2189,the densest distillation of roberts movies ever made,1
2190,with this masterful flawless film lrb wang rrb emerges in the front ranks of china s now numerous worldrenowned filmmakers,4
2191,a livewire film that never loses its ability to shock and amaze,4
2192,throughout all the tumult a question comes to mind so why is this so boring,1
2193,ong chooses to present ah na s life as a slight weightless fairy tale whose most unpleasant details seem to melt away in the face of the character s blankfaced optimism,2
2194,the largeformat film is well suited to capture these musicians in full regalia and the incredible imax sound system lets you feel the beat down to your toes,4
2195,a finely tuned mood piece a model of menacing atmosphere,4
2196,egoyan s work often elegantly considers various levels of reality and uses shifting points of view but here he has constructed a film so labyrinthine that it defeats his larger purpose,2
2197,an original little film about one young woman s education,2
2198,by the end you just do nt care whether that coldhearted snake petrovich lrb that would be reno rrb gets his comeuppance,2
2199,it is packed with adventure and a worthwhile environmental message so it is great for the kids,4
