,text,label
4156,provides a satisfactory overview of the bizarre world of extreme athletes as several daredevils express their own views,3
4157,flat misguided comedy,1
4158,it is been done before but never so vividly or with so much passion,4
4159,berling and bart continue to impress and isabelle huppert again shows uncanny skill in getting under the skin of her characters,3
4160,serious moviegoers embarking upon this journey will find that the road to perdition leads to a satisfying destination,4
4161,this overproduced piece of dreck is shockingly bad and absolutely unnecessary,0
4162,there are moments of hilarity to be had,3
4163,it is hard to imagine anyone managing to steal a movie not only from charismatic rising star jake gyllenhaal but also from accomplished oscar winners susan sarandon dustin hoffman and holly hunter yet newcomer ellen pompeo pulls off the feat with aplomb,4
4164,i never thought i would say this but i would much rather watch teens poking their genitals into fruit pies,1
4165,i suspect this is the kind of production that would have been funnier if the director had released the outtakes theatrically and used the film as a bonus feature on the dvd,1
4166,it offers a glimpse of the solomonic decision facing jewish parents in those turbulent times to save their children and yet to lose them,3
4167,the film jolts the laughs from the audience as if by cattle prod,3
4168,plodding poorly written murky and weakly acted the picture feels as if everyone making it lost their movie mojo,0
4169,elegant mannered and teasing,3
4170,plays like a badly edited 91minute trailer lrb and rrb the director ca nt seem to get a coherent rhythm going,0
4171,there are flaws but also stretches of impact and moments of awe we are wrapped up in the characters how they make their choices and why,3
4172,by turns touching raucously amusing uncomfortable and yes even sexy never again is a welcome and heartwarming addition to the romantic comedy genre,4
4173,not the great american comedy but if you liked the previous movies in the series you will have a good time with this one too,3
4174,kapur s contradictory feelings about his material result in a movie that works against itself,1
4175,but they fascinate in their recklessness,3
4176,a heartbreakingly thoughtful minor classic the work of a genuine and singular artist,4
4177,the animation merely serves up a predictable maudlin story that swipes heavily from bambi and the lion king yet lacks the emotional resonance of either of those movies,2
4178,this is an action movie with an action icon who is been all but decommissioned,1
4179,worth catching for griffiths warm and winning central performance,3
4180,cq may one day be fondly remembered as roman coppola s brief pretentious period before going on to other films that actually tell a story worth caring about,1
4181,who cares rrb,1
4182,neither revelatory nor truly edgy merely crassly flamboyant and comedically labored,0
4183,an unflinching complex portrait of a modern israel that is rarely seen onscreen,3
4184,the first question to ask about bad company is why anthony hopkins is in it,1
4185,an intelligent romantic thriller of a very oldschool kind of quality,3
4186,it is difficult to feel anything much while watching this movie beyond mild disturbance or detached pleasure at the acting,1
4187,a distinctly mixed bag the occasional bursts of sharp writing alternating with lots of sloppiness and the obligatory moments of sentimental ooze,1
4188,it would be disingenuous to call reno a great film but you can say that about most of the flicks moving in and out of the multiplex,2
4189,a bmovie you can sit through enjoy on a certain level and then forget,3
4190,a fascinating dark thriller that keeps you hooked on the delicious pulpiness of its lurid fiction,3
4191,enjoyably dumb sweet and intermittently hilarious if you have a taste for the quirky steal a glimpse,3
4192,there is a great deal of corny dialogue and preposterous moments,1
4193,williams absolutely nails sy s queasy infatuation and overall strangeness,3
4194,curiously super troopers suffers because it does nt have enough vices to merit its 103minute length,1
4195,as exciting as all this exoticism might sound to the typical pax viewer the rest of us will be lulled into a coma,0
4196,watch barbershop again if you are in need of a cube fix this is nt worth sitting through,1
4197,this heist flick about young brooklyn hoods is off the shelf after two years to capitalize on the popularity of vin diesel seth green and barry pepper,2
4198,an awkwardly garish showcase that diverges from anything remotely probing or penetrating,0
4199,diverting french comedy in which a husband has to cope with the pesky moods of jealousy,2
4200,each scene wreaks of routine the film never manages to generate a single threat of suspense,2
4201,certain to be distasteful to children and adults alike eight crazy nights is a total misfire,0
4202,i have nt laughed that hard in years,4
4203,sorvino is delightful in the central role,3
4204,a gracious eloquent film that by its end offers a ray of hope to the refugees able to look ahead and resist living in a past forever lost,4
4205,possibly not since grumpy old men have i heard a film so solidly connect with one demographic while striking out with another,2
4206,what a great way to spend 4 units of your day,3
4207,a passionately inquisitive film determined to uncover the truth and hopefully inspire action,4
4208,both a successful adaptation and an enjoyable film in its own right,4
4209,and vin diesel is the man,3
4210,just a kiss is a just a waste,1
4211,meyjes focuses too much on max when he should be filling the screen with this tortured dull artist and monsterinthe making,2
4212,hilarious musical comedy though stymied by accents thick as mud,2
4213,murder by numbers just does nt add up,1
4214,all three descriptions suit evelyn a besotted and obvious drama that tells us nothing new,1
4215,this is popcorn movie fun with equal doses of action cheese ham and cheek lrb as well as a serious debt to the road warrior rrb but it feels like unrealized potential,3
4216,lrb it rrb highlights not so much the crime lord s messianic bent but spacey s,2
4217,in death to smoochy we do nt get williams usual tear and a smile just sneers and bile and the spectacle is nothing short of refreshing,3
4218,tsai has managed to create an underplayed melodrama about family dynamics and dysfunction that harks back to the spare unchecked heartache of yasujiro ozu,2
4219,an uneven mix of dark satire and childhood awakening,1
4220,the movie is about as humorous as watching your favorite pet get buried alive,0
4221,bears is even worse than i imagined a movie ever could be,0
4222,dramatically lackluster,0
4223,made eddie murphy a movie star and the man has nt aged a day,3
4224,this is an undeniably intriguing film from an adventurous young talent who finds his inspiration on the fringes of the american underground,4
4225,yes mibii is rote work and predictable but with a philosophical visual coming right at the end that extravagantly redeems it,3
4226,their contrast is neither dramatic nor comic it is just a weird fizzle,1
4227,all the characters are clinically depressed and have abandoned their slim hopes and dreams,1
4228,tartakovsky s team has some freakish powers of visual charm but the five writers slip into the modern rut of narrative banality,0
4229,a gently funny sweetly adventurous film that makes you feel genuinely good that is to say entirely unconned by false sentiment or sharp overmanipulative hollywood practices,3
4230,tries too hard to be funny in a way that is too loud too goofy and too short of an attention span,1
4231,the obnoxious title character provides the drama that gives added clout to this doc,3
4232,the sweetest thing a romantic comedy with outrageous tendencies may be a mess in a lot of ways,2
4233,you emerge dazed confused as to whether you have seen pornography or documentary,1
4234,lucy s a dull girl that is all,1
4235,sensitive ensemble performances and good period reconstruction add up to a moving tragedy with some buoyant human moments,4
4236,directed without the expected flair or imagination by hong kong master john woo windtalkers airs just about every cliche in the war movie compendium across its indulgent twohourandfifteenminute length,1
4237,it looks closely insightfully at fragile complex relationships,3
4238,the story has some nice twists but the ending and some of the backstory is a little tired,1
4239,is an inexpressible and drab wannabe looking for that exact niche,1
4240,the mothman prophecies which is mostly a bore seems to exist only for its climactic setpiece,1
4241,spirit is a visual treat and it takes chances that are bold by studio standards but it lacks a strong narrative,3
4242,this is one of the rarest kinds of films a familyoriented nondisney film that is actually funny without hitting below the belt,3
4243,for almost the first twothirds of martin scorsese s 168minute gangs of new york i was entranced,3
4244,a cheap ludicrous attempt at serious horror,0
4245,an unremittingly ugly movie to look at listen to and think about it is quite possibly the sturdiest example yet of why the dv revolution has cheapened the artistry of making a film,0
4246,enticing and often funny documentary,4
4247,but one thing s for sure it never comes close to being either funny or scary,0
4248,the movie eventually snaps under the strain of its plot contrivances and its need to reassure,1
4249,whereas oliver stone s conspiracy thriller jfk was long intricate starstudded and visually flashy interview with the assassin draws its considerable power from simplicity,3
4250,the komediant is a tale worth catching,3
4251,the holes in this film remain agape holes punched through by an inconsistent meandering and sometimes dry plot,1
4252,worth seeing just for weaver and lapaglia,3
4253,a brain twister less a moviemovie than a funny and weird meditation on hollywood success artistic integrity and intellectual bankruptcy,2
4254,let us hope not,2
4255,it follows the blair witch formula for an hour in which we are told something creepy and vague is in the works and then it goes awry in the final 30 minutes,1
4256,an encouraging effort from mccrudden,3
4257,i was amused and entertained by the unfolding of bielinsky s cleverly constructed scenario and greatly impressed by the skill of the actors involved in the enterprise,4
4258,such master screenwriting comes courtesy of john pogue the yale grad who previously gave us the skulls and last year s rollerball,4
4259,initially gripping eventually cloying pow drama,3
4260,this is not a jackie chan movie,1
4261,chamber of secrets will find millions of eager fans,4
4262,you can see the wouldbe surprises coming a mile away and the execution of these twists is delivered with a hammer,2
4263,lacks the visual flair and bouncing bravado that characterizes better hiphop clips and is content to recycle images and characters that were already tired 10 years ago,1
4264,a timid soggy near miss,1
4265,a solidly constructed entertaining thriller that stops short of true inspiration,3
4266,a quiet family drama with a little bit of romance and a dose of darkness,3
4267,smith examines the intimate unguarded moments of folks who live in unusual homes which pop up in nearly every corner of the country,3
4268,i admire it and yet can not recommend it because it overstays its natural running time,1
4269,thoroughly engrossing and ultimately tragic,1
4270,i can analyze this movie in three words thumbs friggin down,0
4271,if only it were well funnier,1
4272,it is messy uncouth incomprehensible vicious and absurd,0
4273,from its invitingly upbeat overture to its pathosfilled but ultimately lifeaffirming finale martin is a masterfully conducted work,3
4274,charly comes off as emotionally manipulative and sadly imitative of innumerable past love story derisions,1
4275,kung pow seems like some futile concoction that was developed hastily after oedekerk and his fellow moviemakers got through crashing a college keg party,0
4276,its premise is smart but the execution is pretty weary,1
4277,an engrossing iranian film about two itinerant teachers and some lost and desolate people they encounter in a place where war has savaged the lives and liberties of the poor and the dispossessed,3
4278,for those for whom the name woody allen was once a guarantee of something fresh sometimes funny and usually genuinely worthwhile hollywood ending is a depressing experience,0
4279,somewhere inside the mess that is world traveler there is a mediocre movie trying to get out,1
4280,first and foremost the reason to go see blue crush is the phenomenal waterborn cinematography by david hennings,4
4281,connoisseurs of chinese film will be pleased to discover that tian s meticulous talent has not withered during his enforced hiatus,3
4282,gaunt silverhaired and leonine lrb harris rrb brings a tragic dimension and savage fullbodied wit and cunning to the aging sandeman,3
4283,left me with the visceral sensation of longing lasting traces of charlotte s web of desire and desperation,3
4284,the problem with the bread my sweet is that it is far too sentimental,1
4285,it may even fall into the category of films you love to hate,2
4286,combines a comically dismal social realism with a farcically bawdy fantasy of redemption and regeneration,3
4287,like a less dizzily gorgeous companion to mr wong s in the mood for love very much a hong kong movie despite its mainland setting,2
4288,loud chaotic and largely unfunny,0
4289,the main characters are simply named the husband the wife and the kidnapper emphasizing the disappointingly generic nature of the entire effort,0
4290,a movie to forget,1
4291,the film s best trick is the way that it treats conspiracy as a kind of political blair witch a monstrous murk that haunts us precisely because it can never be seen,2
4292,rife with nutty cliches and far too much dialogue,1
4293,labute ca nt avoid a fatal mistake in the modern era he is changed the male academic from a lowerclass brit to an american a choice that upsets the novel s exquisite balance and shreds the fabric of the film,2
4294,starts out with tremendous promise introducing an intriguing and alluring premise only to fall prey to a boatload of screenwriting cliches that sink it faster than a leaky freighter,1
4295,a raunchy and frequently hilarious followup to the gifted korean american standup s i am the one that i want,3
4296,a completely spooky piece of business that gets under your skin and some plot blips aside stays there for the duration,3
4297,an artful yet depressing film that makes a melodramatic mountain out of the molehill of a missing bike,1
4298,the movie ends with outtakes in which most of the characters forget their lines and just utter uhhh which is better than most of the writing in the movie,1
4299,every five minutes or so someone gets clocked,2
4300,if that does nt clue you in that something s horribly wrong nothing will,0
4301,this loud and thoroughly obnoxious comedy about a pair of squabbling workingclass spouses is a deeply unpleasant experience,0
4302,it is not an easy one to review,1
4303,ultimately in the history of the academy people may be wondering what all that jazz was about chicago in 2002,1
4304,a puzzling experience,2
4305,the film has a terrific look and salma hayek has a feel for the character at all stages of her life,4
4306,what makes barbershop so likable with all its flaws is that it has none of the pushiness and decibel volume of most contemporary comedies,3
4307,it pulls the rug out from under you just when you are ready to hate one character or really sympathize with another character something happens to send you off in different direction,2
4308,this is for the most part a useless movie even with a great director at the helm,1
4309,lrb reaches rrb wholly believable and heartwrenching depths of despair,3
4310,the film fearlessly gets under the skin of the people involved this makes it not only a detailed historical document but an engaging and moving portrait of a subculture,3
4311,gibney and jarecki just want to string the bastard up,2
4312,for a movie about the power of poetry and passion there is precious little of either,1
4313,unfortunately we would prefer a simple misfire,1
4314,when in doubt the film ratchets up the stirring soundtrack throws in a fishoutofwater gag and lets the cliched dialogue rip,2
4315,a true delight,4
4316,an awful snooze,0
4317,does nt really add up to much,1
4318,an interesting psychological game of catandmouse threedimensional characters and believable performances all add up to a satisfying crime drama,4
4319,a new film from bill plympton the animation master is always welcome,4
4320,watching ending is too often like looking over the outdated clothes and plastic knickknacks at your neighbor s garage sale,1
4321,a thriller made from a completist s checklist rather than with a cultist s passion,2
4322,cox offers plenty of glimpses at existing photos but there are no movies of nijinsky so instead the director treats us to an aimless hodgepodge,0
4323,may be the most undeserving victim of critical overkill since town and country,2
4324,its weighty themes are too grave for youngsters but the story is too steeped in fairy tales and other childish things to appeal much to teenagers,1
4325,nothing happens and it happens to flat characters,1
4326,leaves us wondering less about its ideas and more about its characterization of hitler and the contrived nature of its provocative conclusion,1
4327,white oleander the movie is akin to a reader s digest condensed version of the source material,1
4328,high drama disneystyle a wing and a prayer and a hunky hasbeen pursuing his castle in the sky,3
4329,has its moments but it is pretty far from a treasure,2
4330,goes a long way on hedonistic gusto,2
4331,schnieder bounces around with limp wrists wearing tight tummy tops and hip huggers twirling his hair on his finger and assuming that is enough to sustain laughs,1
4332,a wonderfully speculative character study that made up for its rather slow beginning by drawing me into the picture,3
4333,matches neorealism s impact by showing the humanity of a wartorn land filled with people who just want to live their lives,2
4334,the central character is nt complex enough to hold our interest,2
4335,it is the kind of movie that aside from robert altman spike lee the coen brothers and a few others our moviemakers do nt make often enough,4
4336,the action sequences are fun and reminiscent of combat scenes from the star wars series,3
4337,the work of an exhausted desiccated talent who ca nt get out of his own way,3
4338,the problem is that van wilder does little that is actually funny with the material,1
4339,no cliche escapes the perfervid treatment of gang warfare called ces wild,1
4340,acting can not be acted,2
4341,comes off like a bad imitation of the bard,1
4342,the sweetest thing leaves an awful sour taste,1
4343,it is a great american adventure and a wonderful film to bring to imax,4
4344,resembles a soft porn brian de palma pastiche,1
4345,the director and her capable cast appear to be caught in a heady whirl of new ageinspired good intentions but the spell they cast is nt the least bit mesmerizing,2
4346,a movie that feels like the pilot episode of a new teentargeted action tv series,2
4347,a uniquely sensual metaphorical dramatization of sexual obsession that spends a bit too much time on its fairly ludicrous plot,3
4348,the sentimental cliches mar an otherwise excellent film,3
4349,hollywood has taken quite a nosedive from alfred hitchcock s imaginative flight to shyamalan s selfimportant summer fluff,1
4350,this is standard crime drama fare instantly forgettable and thoroughly dull,0
4351,you wo nt look at religious fanatics or backyard sheds the same way again,2
4352,the combination of lightness and strictness in this instance gives italian for beginners an amiable aimlessness that keeps it from seeming predictably formulaic,2
4353,eyre is on his way to becoming the american indian spike lee,3
4354,in questioning the election process payami graphically illustrates the problems of fledgling democracies but also the strength and sense of freedom the iranian people already possess with or without access to the ballot box,3
4355,not bad but not all that good,2
4356,there is a scientific law to be discerned here that producers would be well to heed mediocre movies start to drag as soon as the action speeds up when the explosions start they fall to pieces,0
4357,borstal boy represents the worst kind of filmmaking the kind that pretends to be passionate and truthful but is really frustratingly timid and soggy,0
4358,old people will love this movie and i mean that in the nicest possible way last orders will touch the heart of anyone old enough to have earned a 50year friendship,2
4359,so genial is the conceit this is one of those rare pictures that you root for throughout dearly hoping that the rich promise of the script will be realized on the screen,3
4360,the only entertainment you will derive from this choppy and sloppy affair will be from unintentional giggles several of them,0
4361,the good girl is a film in which the talent is undeniable but the results are underwhelming,1
4362,more of the same old garbage hollywood has been trying to pass off as acceptable teen entertainment for some time now,0
4363,amazingly dopey,3
4364,the christ allegory does nt work because there is no foundation for it,1
4365,romanek keeps adding flourishes artsy fantasy sequences that simply feel wrong,1
4366,combines improbable melodrama lrb gored bullfighters comatose ballerinas rrb with subtly kinky bedside vigils and sensational denouements and yet at the end we are undeniably touched,3
4367,there is a thin line between likably oldfashioned and fuddyduddy and the count of monte cristo never quite settles on either side,2
4368,you do nt need to be a hiphop fan to appreciate scratch and that is the mark of a documentary that works,3
4369,i am not sure which half of dragonfly is worse the part where nothing s happening or the part where something s happening but it is stupid,0
4370,writerdirector david caesar ladles on the local flavour with a hugely enjoyable film about changing times clashing cultures and the pleasures of a wellmade pizza,4
4371,the journey to the secret s eventual discovery is a separate adventure and thrill enough,3
4372,roman polanski directs the pianist like a surgeon mends a broken heart very meticulously but without any passion,1
4373,it is soulful and unslick and that is apparently just what lrb aniston rrb has always needed to grow into a movie career,4
4374,like blended shades of lipstick these components combine into one terrific story with lots of laughs,4
4375,devos delivers a perfect performance that captures the innocence and budding demons within a wallflower,3
4376,has lost some of the dramatic conviction that underlies the best of comedies,1
4377,tells a fascinating compelling story,4
4378,a plodding look at the french revolution through the eyes of aristocrats,2
4379,ah what the hell,2
4380,like a comedian who starts off promisingly but then proceeds to flop comedian runs out of steam after a half hour,1
4381,gripping and handsome execution lrb but rrb there is nt much about k19 that is unique or memorable,2
4382,one of those films where the characters inhabit that special annex of hell where adults behave like kids children behave like adults and everyone screams at the top of their lungs no matter what the situation,1
4383,devotees of star trek ii the wrath of khan will feel a nagging sense of deja vu and the grandeur of the best next generation episodes is lacking,1
4384,beautifully reclaiming the story of carmen and recreating it an in an african idiom,3
4385,the punch lines that miss unfortunately outnumber the hits by threetoone,1
4386,michel piccoli s moving performance is this films reason for being,3
4387,read my lips is to be viewed and treasured for its extraordinary intelligence and originality as well as its lyrical variations on the game of love,4
4388,those seeking a definitive account of eisenstein s life would do better elsewhere,1
4389,yes soar,3
4390,as banal as the telling may be and at times all my loved ones more than flirts with kitsch the tale commands attention,3
4391,although frailty fits into a classic genre in its script and execution it is a remarkably original work,3
4392,it is young guns meets goodfellas in this easily skippable hayseedsvs,2
4393,naipaul fans may be disappointed,1
4394,attal pushes too hard to make this a comedy or serious drama,0
4395,poignant and moving a walk to remember is an inspirational love story capturing the innocence and idealism of that first encounter,4
4396,in any case i would recommend big bad love only to winger fans who have missed her since 1995 s forget paris,1
4397,by the time it is done with us mira nair s new movie has its audience giddy with the delight of discovery of having been immersed in a foreign culture only to find that human nature is pretty much the same all over,4
4398,the film will appeal to discovery channel fans and will surely widen the perspective of those of us who see the continent through rosecolored glasses,2
4399,you do nt want to call the cops,2
4400,if there is a heaven for bad movies deuces wild is on its way,0
4401,a huge boxoffice hit in korea shiri is a must for genre fans,3
4402,clint eastwood s blood work is a lot like a wellmade pb j sandwich familiar fairly uneventful and boasting no real surprises but still quite tasty and inviting all the same,3
4403,the thing about guys like evans is this you are never quite sure where selfpromotion ends and the truth begins,1
4404,i found myself growing more and more frustrated and detached as vincent became more and more abhorrent,1
