,text,label
0,a stirring funny and finally transporting reimagining of beauty and the beast and 1930s horror films,4
1,apparently reassembled from the cuttingroom floor of any given daytime soap,1
2,they presume their audience wo nt sit still for a sociology lesson however entertainingly presented so they trot out the conventional sciencefiction elements of bugeyed monsters and futuristic women in skimpy clothes,1
3,the entire movie is filled with deja vu moments,2
4,this is a visually stunning rumination on love memory history and the war between art and commerce,3
5,um no,2
6,jonathan parker s bartleby should have been the beallendall of the modernoffice anomie films,3
7,campanella gets the tone just right funny in the middle of sad in the middle of hopeful,3
8,a fan film that for the uninitiated plays better on video with the sound turned down,1
9,bart and berling are both superb while huppert is magnificent,4
10,a little less extreme than in the past with longer exposition sequences between them and with fewer gags to break the tedium,1
11,the film is strictly routine,1
12,a lyrical metaphor for cultural and personal selfdiscovery and a picaresque view of a littleremembered world,3
13,the most repugnant adaptation of a classic text since roland joff and demi moore s the scarlet letter,1
14,for something as splendidlooking as this particular film the viewer expects something special but instead gets lrb scifi rrb rehash,1
15,this is a stunning film a oneofakind tour de force,4
16,may be more genial than ingenious but it gets the job done,3
17,there is a freedom to watching stunts that are this crude this fastpaced and this insane,3
18,if the tuxedo actually were a suit it would fit chan like a 99 bargainbasement special,1
19,as quiet patient and tenacious as mr lopez himself who approaches his difficult endless work with remarkable serenity and discipline,4
20,final verdict you have seen it all before,0
21,blue crush follows the formula but throws in too many conflicts to keep the story compelling,1
22,you get a sense of good intentions derailed by a failure to seek and strike just the right tone,1
23,a slick engrossing melodrama,4
24,a wretched movie that reduces the second world war to one man s quest to find an old flame,1
25,eccentric enough to stave off doldrums caruso as selfconscious debut is also eminently forgettable,2
26,will undoubtedly play well in european markets where mr besson is a brand name and in asia where ms shu is an institution but american audiences will probably find it familiar and insufficiently cathartic,1
27,one of lrb jaglom s rrb better efforts a wry and sometime bitter movie about love,2
28,lacks the inspiration of the original and has a bloated plot that stretches the running time about 10 minutes past a child s interest and an adult s patience,0
29,the santa clause 2 proves itself a more streamlined and thought out encounter than the original could ever have hoped to be,3
30,the film is moody oozing chilling and heartwarming all at once a twisting unpredictable catandmouse thriller,4
31,too bad,1
32,a strong first act and absolutely inescapably gorgeous skyscrapertrapeze motion of the amazing spiderman,4
33,gooding offers a desperately ingratiating performance,1
34,you end up simply admiring this bit or that this performance or that,2
35,a wellintentioned effort that is still too burdened by the actor s offbeat sensibilities for the earnest emotional core to emerge with any degree of accessibility,1
36,analyze that regurgitates and waters down many of the previous film s successes with a few new swings thrown in,2
37,there is a neat twist subtly rendered that could have wrapped things up at 80 minutes but kang tacks on three or four more endings,2
38,a fun ride,3
39,what with the incessant lounge music playing in the film s background you may mistake love liza for an adam sandler chanukah song,2
40,an edgy thriller that delivers a surprising punch,3
41,what is the russian word for wow,3
42,you might say tykwer has done all that heaven allows if you wanted to make as antikieslowski a pun as possible,2
43,many shallower movies these days seem too long but this one is egregiously short,2
44,ottosallies has a real filmmaker s eye,3
45,lurid and less than lucid work,1
46,a portrait of an artist,2
47,once again the intelligence of gay audiences has been grossly underestimated and a meaty plot and welldeveloped characters have been sacrificed for skin and flash that barely fizzle,2
48,with a confrontational stance todd solondz takes aim on political correctness and suburban families,2
49,many of the effective horror elements are dampened through familiarity lrb yet rrb are worthwhile,2
50,with its parade of almost perpetually wasted characters margarita feels like a hazy high that takes too long to shake,1
51,i could just feel the screenwriter at every moment tap tap tap tap tapping away on this screenplay,1
52,overall cletis tout is a winning comedy that excites the imagination and tickles the funny bone,4
53,you live the mood rather than savour the story,3
54,the movie is so thoughtlessly assembled,3
55,here polanski looks back on those places he saw at childhood and captures them by freeing them from artefact and by showing them heartbreakingly drably,2
56,some body is a shaky uncertain film that nevertheless touches a few raw nerves,3
57,it is a very sincere work but it would be better as a diary or documentary,3
58,while american adobo has its heart lrb and its palate rrb in the right place its brain is a little scattered ditsy even,1
59,unfolds with such a wallop of youarethere immediacy that when the bullets start to fly your first instinct is to duck,4
60,and it is a lousy one at that,0
61,it is not too fast and not too slow,3
62,it is an entertaining movie and the effects boosted to the size of a downtown hotel will all but take you to outer space,3
63,it is as uncompromising as it is nonjudgmental and makes clear that a prostitute can be as lonely and needy as any of the clients,3
64,compellingly watchable,4
65,despite some comic sparks welcome to collinwood never catches fire,1
66,he may have meant the internet short saving ryan s privates,2
67,though jackson does nt always succeed in integrating the characters in the foreground into the extraordinarily rich landscape it must be said that he is an imaginative filmmaker who can see the forest for the trees,3
68,not only does spiderman deliver but i suspect it might deliver again and again,4
69,it is worth taking the kids to,4
70,the movie plays up the cartoon s more obvious strength of snazziness while neglecting its less conspicuous writing strength,2
71,without shakespeare s eloquent language the update is dreary and sluggish,0
72,dense exhilarating documentary,3
73,feels as if lrb there is rrb a choke leash around your neck so director nick cassavetes can give it a good hard yank whenever he wants you to feel something,0
74,poignant if familiar story of a young person suspended between two cultures,3
75,a perfectly acceptable perfectly bland competently acted but by no means scary horror movie,2
76,methodical measured and gently tedious in its comedy secret ballot is a purposefully reductive movie which may be why it is so successful at lodging itself in the brain,4
77,this is amusing for about three minutes,2
78,though a touch too arthouse 101 in its poetic symbolism heaven proves to be a good match of the sensibilities of two directors,3
79,superbly photographed and staged by mendes with a series of riveting set pieces the likes of which mainstream audiences have rarely seen,4
80,a metaphor for a modernday urban china searching for its identity,3
81,it is a square sentimental drama that satisfies as comfort food often can,3
82,the wonderfully lush morvern callar is pure punk existentialism and ms ramsay and her cowriter liana dognini have dramatized the alan warner novel which itself felt like an answer to irvine welsh s book trainspotting,3
83,admirers of director abel ferrara may be relieved that his latest feature r xmas marks a modest if encouraging return to form,4
84,not once in the rush to save the day did i become very involved in the proceedings to me it was just a matter of eh,1
85,an uglyduckling tale so hideously and clumsily told it feels accidental,0
86,becomes a bit of a mishmash a tearjerker that does nt and a thriller that wo nt,0
87,at its worst the movie is pretty diverting the pity is that it rarely achieves its best,2
88,could i have been more geeked when i heard that apollo 13 was going to be released in imax format,4
89,this is a very ambitious project for a fairly inexperienced filmmaker but good actors good poetry and good music help sustain it,3
90,more successful at relating history than in creating an emotionally complex dramatically satisfying heroine,1
91,cho s timing is priceless,4
92,criminal conspiracies and true romances move so easily across racial and cultural lines in the film that it makes my big fat greek wedding look like an apartheid drama,3
93,there is something to be said for a studioproduced film that never bothers to hand viewers a suitcase full of easy answers,3
94,what elevates the movie above the runofthemill singles blender is its surreal sense of humor and technological finish,4
95,greengrass lrb working from don mullan s script rrb forgoes the larger sociopolitical picture of the situation in northern ireland in favour of an approach that throws one in the pulsating thick of a truly frightening situation,2
96,nicholson s understated performance is wonderful,4
97,the filmmakers know how to please the eye but it is not always the prettiest pictures that tell the best story,3
98,it is unfortunate that wallace who wrote gibson s braveheart as well as the recent pearl harbor has such an irrepressible passion for sappy situations and dialogue,1
99,jackson shamefully strolls through this mess with a smug grin inexplicably wearing a kilt and carrying a bag of golf clubs over one shoulder,1
100,jackson tries to keep the plates spinning as best he can but all the bouncing back and forth ca nt help but become a bit tedious even with the breathtaking landscapes and villainous varmints there to distract you from the ricocheting,2
101,a fascinating curiosity piece fascinating that is for about ten minutes,1
102,over and over again,1
103,nolan proves that he can cross swords with the best of them and helm a more traditionally plotted popcorn thriller while surrendering little of his intellectual rigor or creative composure,4
104,this bond film goes off the beaten path not necessarily for the better,1
105,its solemn pretension prevents us from sharing the awe in which it holds itself,1
106,the drama discloses almost nothing,1
107,a sham construct based on theory sleightofhand and illwrought hypothesis,1
108,isabelle huppert excels as the enigmatic mika and anna mouglalis is a stunning new young talent in one of chabrol s most intense psychological mysteries,4
109,but why,2
110,like its parade of predecessors this halloween is a gory slashfest,3
111,perhaps the best sports movie i have ever seen,4
112,this pathetic junk is barely an hour long,0
113,ou ve got to love a disney pic with as little cleavage as this one has and a heroine as feisty and principled as jane,3
114,this is a gorgeous film vivid with color music and life,4
115,playing a role of almost bergmanesque intensity bisset is both convincing and radiant,3
116,the trappings of i spy are so familiar you might as well be watching a rerun,1
117,it treats ana s journey with honesty that is tragically rare in the depiction of young women in film,3
118,leigh makes these lives count,3
119,igby goes down is one of those movies,2
120,ambitious unsettling psychodrama that takes full chilling advantage of its rougharoundtheedges lowbudget constraints,3
121,the woodman seems to have directly influenced this girlmeetsgirl love story but even more reassuring is how its makers actually seem to understand what made allen s romantic comedies so pertinent and enduring,3
122,i could nt recommend this film more,3
123,an inexperienced director mehta has much to learn,1
124,you can taste it but there is no fizz,1
125,a reworking of die hard and cliffhanger but it is nowhere near as exciting as either,1
126,a moving tale of love and destruction in unexpected places unexamined lives,3
127,it has more than a few moments that are insightful enough to be fondly remembered in the endlessly challenging maze of moviegoing,3
128,why,1
129,and that is where ararat went astray,1
130,vincent gallo is right at home in this french shocker playing his usual bad boy weirdo role,3
131,clockstoppers is one of those crazy mixedup films that does nt know what it wants to be when it grows up,1
132,sandra bullock despite downplaying her good looks carries a little too much ai nt shecute baggage into her lead role as a troubled and determined homicide cop to quite pull off the heavy stuff,1
133,it is mostly a pleasure to watch,3
134,a bit too derivative to stand on its own as the psychological thriller it purports to be,2
135,its spirit of iconoclastic abandon however canned makes for unexpectedly giddy viewing,3
136,a kilted jackson is an unsettling sight and indicative of his if you will outofkilter character who rambles aimlessly through illconceived action pieces,1
137,i did nt find much fascination in the swinging,1
138,this is no waterboy,1
139,but the nerveraked acting the crackle of lines the impressive stagings of hardware make for some robust and scary entertainment,4
140,a witty trenchant wildly unsentimental but flawed look at the ins and outs of modern moviemaking,2
141,babyfaced renner is eerily convincing as this bland blank of a man with unimaginable demons within,3
142,the name says it all,2
143,the kind of primal storytelling that george lucas can only dream of,3
144,it is been 20 years since 48 hrs,2
145,uplifting as only a document of the worst possibilities of mankind can be and among the best films of the year,4
146,the irwins scenes are fascinating the movie as a whole is cheap junk and an insult to their deathdefying efforts,0
147,it is a frightful vanity film that no doubt pays off what debt miramax felt they owed to benigni,0
148,he seems to want both but succeeds in making neither,1
149,funny though,2
150,by turns fanciful grisly and engagingly quixotic,3
151,the rerelease of ron howard s apollo 13 in the imax format proves absolutely that really really really good things can come in enormous packages,3
152,unofficially national lampoon s van wilder is son of animal house,2
153,it never is not fully,2
154,it is just a little too selfsatisfied,2
155,i have never seen lrb a remake rrb do anything as stomachturning as the way adam sandler s new movie rapes pillages and incinerates frank capra s classic,0
156,those who want to be jolted out of their gourd should drop everything and run to ichi,3
157,post 911 the philosophical message of personal freedom first might not be as palatable as intended,2
158,mr deeds is as comedy goes very silly and in the best way,4
159,this amiable picture talks tough but it is all bluster in the end it is as sweet as greenfingers,3
160,my little eye is the best little horror movie i have seen in years,4
161,the movie is a negligible work of manipulation an exploitation piece doing its usual worst to guilttrip parents,1
162,it may work as a jaunt down memory lane for teens and young adults who grew up on televised scoobydoo shows or reruns,3
163,suffers from a flat script and a low budget,1
164,the movie is well done but slow,1
165,the plot plummets into a comedy graveyard before janice comes racing to the rescue in the final reel,2
166,the master of disguise is awful,0
167,it is an actor s showcase that accomplishes its primary goal without the use of special effects but rather by emphasizing the characters including the supporting ones,2
168,same song second verse coulda been better but it coulda been worse,2
169,the film is one of the year s best,4
170,that the chuck norris grenade gag occurs about 7 times during windtalkers is a good indication of how seriousminded the film is,2
171,frida is certainly no disaster but neither is it the kahlo movie frida fans have been looking for,2
172,one of the year s most weirdly engaging and unpredictable character pieces,4
173,the direction occasionally rises to the level of marginal competence but for most of the film it is hard to tell who is chasing who or why,1
174,the three leads produce adequate performances but what is missing from this material is any depth of feeling,0
175,looking for leonard just seems to kinda sit in neutral hoping for a stiff wind to blow it uphill or something,1
176,the most surprising thing about this film is that they are actually releasing it into theaters,0
177,one resurrection too many,1
178,oh look at that clever angle,3
179,warmedover hash,2
180,no i hate it,0
181,for a long time the film succeeds with its dark delicate treatment of these characters and its unerring respect for them,3
182,the casting of raymond j barry as the assassin greatly enhances the quality of neil burger s impressive fake documentary,3
183,the film is like sitting in a downtown caf overhearing a bunch of typical latetwentysomethings natter on about nothing and desperately wishing you could change tables,0
184,the filmmakers want nothing else than to show us a good time and in their cheap b movie way they succeed,3
185,a rollicking ride with jawdropping action sequences striking villains a gorgeous color palette astounding technology stirring music and a boffo last hour that leads up to a strangely sinister happy ending,4
186,an hour and a half of joyful solo performance,4
187,contrived pastiche of caper clichs,1
188,a triumph a film that hews out a world and carries us effortlessly from darkness to light,4
189,steven soderbergh s digital video experiment is a clever and cutting quick and dirty look at modern living and movie life,3
190,kinnear s performance is a careerdefining revelation,4
191,not only a reminder of how they used to make movies but also how they sometimes still can be made,3
192,the dragons are the real stars of reign of fire and you wo nt be disappointed,3
193,if you are over 25 have an iq over 90 and have a driver s license you should be able to find better entertainment,0
194,for devotees of french cinema safe conduct is so rich with period minutiae it is like dying and going to celluloid heaven,4
195,scherfig who has had a successful career in tv tackles more than she can handle,1
196,really dumb but occasionally really funny,2
197,this sade is hardly a perverse dangerous libertine and agitator which would have made for better drama,1
198,by the end of the movie you are definitely convinced that these women are spectacular,3
199,a plotline that is as lumpy as twoday old porridge the filmmakers paws sad to say were all over this unbearable project,0
200,largely this is a movie that also does it by the numbers,2
201,the modernday royals have nothing on these guys when it comes to scandals,1
202,essentially fatal attraction remade for viewers who were in diapers when the original was released in 1987,1
203,it does nt really know or care about the characters and uses them as markers for a series of preordained events,1
204,opening up the play more has partly closed it down,1
205,even though it is common knowledge that park and his founding partner yong kang lost kozmo in the end you ca nt help but get caught up in the thrill of the company s astonishing growth,3
206,lots of effort and intelligence are on display but in execution it is all awkward static and lifeless rumblings,0
207,every moment crackles with tension and by the end of the flick you are on the edge of your seat,4
208,the imax screen enhances the personal touch of manual animation,4
209,coal is nt as easy to come by as it used to be and this would be a worthy substitute for naughty children s stockings,1
210,as pedestrian as they come,0
211,why you may ask why should you buy the movie milk when the tv cow is free,1
212,sunk by way too much indulgence of scenechewing teethgnashing actorliness,0
213,that is fun for kids of any age,4
214,raimi and his team could nt have done any better in bringing the story of spiderman to the big screen,4
215,a colorful joyous celebration of life a tapestry woven of romance dancing singing and unforgettable characters,4
216,frank mcklusky ci is that movie,2
217,a riproaring comedy action fest that ll put hairs on your chest,3
218,the premise of jason x is silly but strangely believable,3
219,the modernday characters are nowhere near as vivid as the 19thcentury ones,1
220,chelsea walls is a case of too many chefs fussing over too weak a recipe,1
221,the cast keeps this pretty watchable and casting mick jagger as director of the escort service was inspired,3
222,plods along minus the twisted humor and eyepopping visuals that have made miike a cult hero,2
223,lrb the kid s rrb just too bratty for sympathy and as the film grows to its finale his little changes ring hollow,1
224,contradicts everything we have come to expect from movies nowadays,3
225,there is little question that this is a serious work by an important director who has something new to say about how in the flipflop of courtship we often reel in when we should be playing out,3
226,the script has less spice than a rat burger and the rock s fighting skills are more in line with steven seagal,1
227,the solid filmmaking and convincing characters makes this a high water mark for this genre,4
228,the kind of movie that comes along only occasionally one so unconventional gutsy and perfectly executed it takes your breath away,4
229,and a very rainy day,2
230,with an admirably dark first script by brent hanley paxton making his directorial feature debut does strong measured work,4
231,the film has a childlike quality about it,2
232,a really funny fifteenminute short stretched beyond its limits to fill an almost featurelength film,2
233,gone are the flamboyant mannerisms that are the trademark of several of his performances,2
234,funny somber absurd and finally achingly sad bartleby is a fine understated piece of filmmaking,4
235,every now and again a movie comes along to remind us of how very bad a motion picture can truly be,0
236,unfortunately there is almost nothing in this flat effort that will amuse or entertain them either,1
237,schrader examines crane s decline with unblinking candor,3
238,count on his movie to work at the back of your neck long after you leave the theater,2
239,that the egraveyard holds as many good ideas as bad is the cold comfort that chin s film serves up with style and empathy,3
240,you would nt want to live waydowntown but it is a hilarious place to visit,3
241,the bai brothers have taken an small slice of history and opened it up for all of us to understand and they have told a nice little story in the process,4
242,there is not one decent performance from the cast and not one clever line of dialogue,0
243,translation we do nt need to try very hard,1
244,return to never land is reliable standard disney animated fare with enough creative energy and wit to entertain all ages,4
245,it sticks rigidly to the paradigm rarely permitting its characters more than two obvious dimensions and repeatedly placing them in contrived wellworn situations,1
246,in many ways reminiscent of 1992 s unforgiven which also utilized the scintillating force of its actors to draw out the menace of its sparse dialogue,2
247,caine makes us watch as his character awakens to the notion that to be human is eventually to have to choose,3
248,a captivating and intimate study about dying and loving,4
249,oversexed at times overwrought comedydrama that offers little insight into the experience of being forty female and single,0
250,the world needs more filmmakers with passionate enthusiasms like martin scorsese,4
251,the director seems to take an unseemly pleasure in lrb the characters rrb misery and at the same time to congratulate himself for having the guts to confront it,1
252,the history is fascinating the action is dazzling,4
253,the unexpected thing is that its dying in this shower of blackandwhite psychedelia is quite beautiful,3
254,i also believe that resident evil is not it,1
255,if only there were one for this kind of movie,2
256,offers a cleareyed chronicle of a female friendship that is more complex and honest than anything represented in a hollywood film,4
257,it may be about drug dealers kidnapping and unsavory folks but the tone and pacing are shockingly intimate,2
258,meeting even exceeding expectations it is the best sequel since the empire strikes back a majestic achievement an epic of astonishing grandeur and surprising emotional depth,4
259,while general audiences might not come away with a greater knowledge of the facts of cuban music they will be treated to an impressive and highly entertaining celebration of its sounds,4
260,not only better than its predecessor it may rate as the most magical and most fun family fare of this or any recent holiday season,4
261,may work as an addictive guilty pleasure but the material never overcomes its questionable satirical ambivalence,1
262,death to smoochy tells a moldyoldie notnearly asnasty asit thinksitis joke,1
263,spielberg s picture is smarter and subtler than lrb total recall and blade runner rrb although its plot may prove too convoluted for funseeking summer audiences,3
264,hart s war seems to want to be a character study but apparently ca nt quite decide which character,1
265,smaller numbered kidlets will enjoy,3
266,offers no new insight on the matter nor do its characters exactly spring to life,0
267,i am convinced i could keep a family of five blind crippled amish people alive in this situation better than these british soldiers do at keeping themselves kicking,1
